[
  {
    "id": "20250602_090729",
    "filename": "20250602_090339_Resume new - Sneha Bhat.pdf",
    "uploaded_at": "2025-06-01T06:00:37Z",
    "status": "parsed_and_stored",
    "uploaded_by": "pranamya-jain",
    "team": "Seeds! \ud83c\udf31",
    "name": "Sneha Datthathray Bhat",
    "email": "snehaaa.bhat@gmail.com",
    "phone": "+91 9481067835",
    "location": null,
    "skills": [
      "Python",
      "NumPy",
      "Pandas",
      "SciPy",
      "Scikit-learn",
      "Keras",
      "TensorFlow",
      "PyTorch",
      "OpenCV",
      "BeautifulSoup",
      "SQL (MySQL)",
      "R",
      "Java",
      "C++",
      "Regression",
      "Classification",
      "Clustering",
      "Natural Language Processing (NLP)",
      "Large Language Models (LLM)",
      "Computer Vision",
      "Transfer Learning",
      "GenAI",
      "Neural Networks",
      "CNN",
      "RNN",
      "Transformer Models",
      "Power BI",
      "Tableau",
      "Matplotlib",
      "Seaborn",
      "Plotly",
      "Full Stack (HTML, CSS, JavaScript, React, Node.js, Express, MongoDB)",
      "Analytical Thinking",
      "Problem-Solving",
      "Effective Communication (technical & non-technical)",
      "Curiosity & Continuous Learning",
      "Attention to Detail",
      "Time Management",
      "Team Collaboration",
      "Adaptability to Evolving Technologies",
      "Critical Thinking",
      "Agile Mindset",
      "Creativity in Solution Design",
      "Accountability & Ownership"
    ],
    "experience": [
      {
        "title": "IBM WatsonX 50k Grant Project Intern",
        "company": "IBM",
        "duration": "On going",
        "description": "Conducted data preprocessing, cleaning, and annotation on legal case documents for AI model training.\nDeveloped a Gen AI-based text summarization and precedent extraction module for legal case analysis.\nCollaborated on building a prototype for an explainable Legal Case and Precedent Analyzer to assist Indian judiciary processes."
      },
      {
        "title": "NLP Project intern",
        "company": "Kannada Ganaka Parishatthu",
        "duration": "On going",
        "description": "Developing a Natural Language Processing-based PDF toolkit application for Kannada Ganaka Parishat.\nImplementing text extraction, summarization, and conversion features for Kannada language PDFs.\nBuilding native language resource tools to support efficient processing and manipulation of Kannada text documents."
      },
      {
        "title": "Core Member",
        "company": "Tensor.ai",
        "duration": null,
        "description": "Organized AI/ML hackathons, workshops, and technical events. Promoted research and project initiatives, and contributed to event planning, resource coordination, and mentoring."
      }
    ],
    "education": [
      {
        "degree": "Bachelor of Engineering",
        "institution": "M S Ramaiah Institute of Technology",
        "year": "2022 - 2026",
        "field": "Artificial Intelligence and Data Science"
      },
      {
        "degree": "10 th / SSLC",
        "institution": "Karnataka Secondary Education Examination Board",
        "year": "2019- 2020",
        "field": null
      },
      {
        "degree": "12 th / PUC",
        "institution": "Department of Pre-University Education , Karnataka",
        "year": "2020 - 2022",
        "field": null
      }
    ],
    "experience_years": null,
    "summary": "I am a Bachelor of Engineering student in Artificial Intelligence and Data Science at M S Ramaiah Institute of Technology. AI & Data Science enthusiast with experience in developing AI-driven healthcare solutions, web applications, and multi-modal data analysis. Proven hackathon winner and interested in real world problem solving with strong foundations in Python, Machine Learning, and Web Development.",
    "certifications": [],
    "languages": [],
    "projects": [
      {
        "name": "Audio-video-transcription with AI",
        "description": "Developed a Streamlit-based application to extract and transcribe audio from video files using AI models. Integrated AI-generated text-to-speech to replace original audio while preserving video synchronization. Enabled seamless audio-video merging with improved clarity, supporting multilingual transcription and speech generation.",
        "technologies": [
          "Streamlit",
          "AI Models"
        ]
      },
      {
        "name": "AI approach for Early detection and predicting the risk of Genomic and proteomic diseases",
        "description": "AI for Protein Interaction and Disease Risk Prediction Developed GNN and Gen AI models to predict protein interactions and assess disease risks from genomic and proteomic data, achieving 83.13% accuracy and enabling early detection through biomarker analysis.",
        "technologies": [
          "GNN",
          "Gen AI models"
        ]
      },
      {
        "name": "Blockchain and AI driven approach for the efficient Parkinson disease episode prediction",
        "description": "Designed an AI-powered system for early detection and continuous monitoring of Parkinson\u2019s Disease symptoms.Integrated wearable sensor data with machine learning algorithms to predict and track patient motor fluctuations and tremors.Utilized blockchain technology to securely store and manage patient health records, enhancing data privacy and accessibility for healthcare providers.",
        "technologies": [
          "AI",
          "Machine learning",
          "Blockchain"
        ]
      },
      {
        "name": "AI-Driven Early Diagnosis of Pediatric Autoimmune Disorders Using Retinal Imaging & Blood Biomarkers",
        "description": "Developing an AI-powered diagnostic system integrating biomarkers, retinal imaging, and patient history for early prediction of autoimmune diseases (MS, T1D, RA, SLE). Implemented Vision Transformer (ViT) for image analysis, TabNet for biomarker prediction, and a multi-modal deep learning model. Deployed a web-based interface delivering explainable risk scores to support clinical decision-making.",
        "technologies": [
          "Vision Transformer (ViT)",
          "TabNet"
        ]
      },
      {
        "name": "To-Do list",
        "description": "Developed a responsive To-Do List web application using HTML and CSS.Implemented features for task creation, editing, deletion, and status updates to manage daily activities.Added task categorization and prioritization options to enhance productivity, task organization, and user experience.",
        "technologies": [
          "HTML",
          "CSS"
        ]
      },
      {
        "name": "Fantom Code 2024 Hackathon - Winner, RVITM, Bengaluru",
        "description": "Parkinson\u2019s Disease Detection and Monitoring System Designed a system for early detection and monitoring of Parkinson\u2019s Disease using wearable sensors, AI algorithms, and blockchain to improve patient quality of life.",
        "technologies": [
          "wearable sensors",
          "AI algorithms",
          "blockchain"
        ]
      },
      {
        "name": "SEED'24 International Hackathon - 1st Prize, SEED Global Education",
        "description": "Parkinson\u2019s Disease Detection and Monitoring System Designed a system for early detection and monitoring of Parkinson\u2019s Disease using wearable sensors, AI algorithms, and blockchain to improve patient quality of life.",
        "technologies": [
          "wearable sensors",
          "AI algorithms",
          "blockchain"
        ]
      }
    ],
    "raw_text": "Sneha Datthathray Bhat\n  Artificial Intelligence and Data Science\n +91 9481067835\n  snehaaa.bhat@gmail.com\n  GitHub | LinkedIn\n  Nationality : Indian\n\nI am a Bachelor of Engineering student in Artificial Intelligence and Data Science at M S Ramaiah Institute of Technology. AI & Data Science\n  enthusiast with experience in developing AI-driven healthcare solutions, web applications, and multi-modal data analysis. Proven hackathon\n  winner and interested in real world problem solving with strong foundations in Python, Machine Learning, and Web Development.\n\nIBM WatsonX 50k Grant Project Intern\n IBM,\n On going ,\n \u25cf\u200bConducted data preprocessing, cleaning, and annotation on legal case documents for AI model training.\n \u25cf\u200bDeveloped a Gen AI-based text summarization and precedent extraction module for legal case analysis.\n \u25cf\u200bCollaborated on building a prototype for an explainable Legal Case and Precedent Analyzer to assist Indian judiciary processes.\n\n NLP Project intern\n Kannada Ganaka Parishatthu,\n On going ,\n \u25cf\u200bDeveloping a Natural Language Processing-based PDF toolkit application for Kannada Ganaka Parishat.\n \u25cf\u200bImplementing text extraction, summarization, and conversion features for Kannada language PDFs.\n \u25cf\u200bBuilding native language resource tools to support efficient processing and manipulation of Kannada text documents.\n\n.\n\u25cf\u200b   Audio-video-transcription with AI:\n      Developed a Streamlit-based application to extract and transcribe audio from video files using AI models.\u200b\n       Integrated AI-generated text-to-speech to replace original audio while preserving video synchronization.\n      Enabled seamless audio-video merging with improved clarity, supporting multilingual transcription and speech generation.\n\n\u25cf\u200b   AI approach for Early detection and predicting the risk of Genomic and proteomic diseases:\n     AI for Protein Interaction and Disease Risk Prediction Developed GNN and Gen AI models to predict protein interactions and assess disease\n       risks from genomic and proteomic data, achieving 83.13% accuracy and enabling early detection through biomarker analysis.\n\n\u25cf\u200b   Blockchain and AI driven approach for the efficient Parkinson disease episode prediction :\n \u200b    Designed an AI-powered system for early detection and continuous monitoring of Parkinson\u2019s Disease symptoms.Integrated wearable sensor\n      data with machine learning algorithms to predict and track patient motor fluctuations and tremors.Utilized blockchain technology to securely\n      store and manage patient health records, enhancing data privacy and accessibility for healthcare providers.\n\n\u25cf\u200b   AI-Driven Early Diagnosis of Pediatric Autoimmune  Disorders Using Retinal Imaging & Blood Biomarkers :\n \u200b    Developing an AI-powered diagnostic system integrating biomarkers, retinal imaging, and patient history for early prediction of autoimmune\n      diseases (MS, T1D, RA, SLE). Implemented Vision Transformer (ViT) for image analysis, TabNet for biomarker prediction, and a\n      multi-modal deep learning model. Deployed a web-based interface delivering explainable risk scores to support clinical decision-making.\n\n\u25cf\u200b   To-Do list:\n     Developed a responsive To-Do List web application using HTML and CSS.Implemented features for task creation, editing, deletion, and status\n      updates to manage daily activities.Added task categorization and prioritization options to enhance productivity, task organization, and user\n      experience.\n\n10 th / SSLC Karnataka Secondary Education Examination Board \u2013 98%                                   2019- 2020\n\n  12 th / PUC Department of Pre-University Education , Karnataka \u2013 92%                                  2020 - 2022\n\n M S Ramaiah Institute of Technology (Artificial Intelligence and Data Science) -CGPA \u2013 9.42                 2022 - 2026\nSneha Datthathray Bhat \n   Artificial Intelligence and Data Science \n\n+91 9481067835 \nsnehaaa.bhat@gmail.com \nGitHub | LinkedIn \n   Nationality : Indian \n\nI am a Bachelor of Engineering student in Artificial Intelligence and Data Science at M S Ramaiah Institute of Technology. AI & Data Science \nenthusiast with experience in developing AI-driven healthcare solutions, web applications, and multi-modal data analysis. Proven hackathon \nwinner and interested in real world problem solving with strong foundations in Python, Machine Learning, and Web Development. \n\nIBM WatsonX 50k Grant Project Intern \nIBM, \nOn going , \n\u25cf\u200bConducted data preprocessing, cleaning, and annotation on legal case documents for AI model training. \n\u25cf\u200bDeveloped a Gen AI-based text summarization and precedent extraction module for legal case analysis. \n\u25cf\u200bCollaborated on building a prototype for an explainable Legal Case and Precedent Analyzer to assist Indian judiciary processes. \n     \nNLP Project intern \nKannada Ganaka Parishatthu, \nOn going , \n\u25cf\u200bDeveloping a Natural Language Processing-based PDF toolkit application for Kannada Ganaka Parishat. \n\u25cf\u200bImplementing text extraction, summarization, and conversion features for Kannada language PDFs. \n\u25cf\u200bBuilding native language resource tools to support efficient processing and manipulation of Kannada text documents. \n\n. \n\n\u25cf\u200b\nAudio-video-transcription with AI: \n          Developed a Streamlit-based application to extract and transcribe audio from video files using AI models.\u200b\n\n Integrated AI-generated text-to-speech to replace original audio while preserving video synchronization. \n          Enabled seamless audio-video merging with improved clarity, supporting multilingual transcription and speech generation. \n \n\u25cf\u200b\nAI approach for Early detection and predicting the  risk of Genomic and proteomic diseases: \n         AI for Protein Interaction and Disease Risk Prediction Developed GNN and Gen AI models to predict protein interactions and assess disease \n\nrisks from genomic and proteomic data, achieving 83.13% accuracy and enabling early detection through biomarker analysis. \n \n\u25cf\u200b\nBlockchain and AI driven approach for the efficient  Parkinson disease episode prediction : \n\u200b\nDesigned an AI-powered system for early detection and continuous monitoring of Parkinson\u2019s Disease symptoms.Integrated wearable sensor \ndata with machine learning algorithms to predict and track patient motor fluctuations and tremors.Utilized blockchain technology to securely \nstore and manage patient health records, enhancing data privacy and accessibility for healthcare providers. \n \n\u25cf\u200b\nAI-Driven Early Diagnosis of Pediatric  Autoimmune   Disorders Using Retinal Imaging & Blood Biomarkers : \n\u200b\nDeveloping an AI-powered diagnostic system integrating biomarkers, retinal imaging, and patient history for early prediction of autoimmune \ndiseases (MS, T1D, RA, SLE). Implemented Vision Transformer (ViT) for image analysis, TabNet for biomarker prediction, and a \nmulti-modal deep learning model. Deployed a web-based interface delivering explainable risk scores to support clinical decision-making. \n \n\u25cf\u200b\nTo-Do list: \n         Developed a responsive To-Do List web application using HTML and CSS.Implemented features for task creation, editing, deletion, and status \n\nupdates to manage daily activities.Added task categorization and prioritization options to enhance productivity, task organization, and user \nexperience. \n\n10 th / SSLC Karnataka Secondary Education Examination Board \u2013 98% \n2019- 2020 \n\n12 th / PUC Department of Pre-University Education , Karnataka \u2013 92% \n2020 - 2022 \n\nM S Ramaiah Institute of Technology (Artificial Intelligence and Data Science)  -CGPA \u2013 9.42 \n\n2022 - 2026 \n\nSoft Skills :\n\n Analytical Thinking, Problem-Solving, Effective Communication (technical & non-technical), Curiosity & Continuous Learning, Attention to\n Detail, Time Management, Team Collaboration, Adaptability to Evolving Technologies, Critical Thinking, Agile Mindset, Creativity in Solution\n Design, Accountability & Ownership\n\n\u25cf\u200b   Programming & Data Tools: Python (NumPy, Pandas, SciPy, Scikit-learn, Keras, TensorFlow, PyTorch, OpenCV, BeautifulSoup), SQL\n    (MySQL), R , Java , C++\n\n\u25cf\u200b   Machine Learning: Regression, Classification, Clustering, Natural Language Processing (NLP), Large Language Models (LLM), Computer\n      Vision, Transfer Learning, GenAI\n\n\u25cf\u200b   Deep Learning: Neural Networks, CNN, RNN, Transformer Models, TensorFlow, PyTorch\n\n\u25cf\u200b   Data Visualization: Power BI, Tableau, Matplotlib, Seaborn, Plotly\n\n\u25cf\u200b  Web Development: Full Stack (HTML, CSS, JavaScript, React, Node.js, Express, MongoDB)\n\n\u25cf\u200b  Fantom Code 2024 Hackathon - Winner, RVITM, Bengaluru\n     Parkinson\u2019s Disease Detection and Monitoring System Designed a system for early detection and monitoring of Parkinson\u2019s Disease using\n    wearable sensors, AI algorithms, and blockchain to improve patient quality of life.\n\n\u25cf\u200b  SEED'24 International Hackathon - 1st Prize, SEED Global Education\n     Parkinson\u2019s Disease Detection and Monitoring System Designed a system for early detection and monitoring of Parkinson\u2019s Disease using\n    wearable sensors, AI algorithms, and blockchain to improve patient quality of life.\n\n\u25cf\u200b  Core Member, Tensor.ai\n    Organized AI/ML hackathons, workshops, and technical events. Promoted research and project initiatives, and contributed to event planning,\n     resource coordination, and mentoring.\n\nSoft Skills : \n\nAnalytical Thinking, Problem-Solving, Effective Communication (technical & non-technical), Curiosity & Continuous Learning, Attention to \nDetail, Time Management, Team Collaboration, Adaptability to Evolving Technologies, Critical Thinking, Agile Mindset, Creativity in Solution \nDesign, Accountability & Ownership \n\n\u25cf\u200b\nProgramming & Data Tools: Python (NumPy, Pandas, SciPy, Scikit-learn, Keras, TensorFlow, PyTorch, OpenCV, BeautifulSoup), SQL \n(MySQL),  R , Java , C++ \n\n\u25cf\u200b\nMachine Learning: Regression, Classification, Clustering, Natural Language Processing (NLP), Large Language Models (LLM), Computer \nVision, Transfer Learning, GenAI \n\n\u25cf\u200b\nDeep Learning: Neural Networks, CNN, RNN, Transformer Models, TensorFlow, PyTorch \n\n\u25cf\u200b\nData Visualization: Power BI, Tableau, Matplotlib, Seaborn, Plotly \n\n\u25cf\u200b\nWeb Development: Full Stack (HTML, CSS, JavaScript, React, Node.js, Express, MongoDB) \n\n\u25cf\u200b\nFantom Code 2024 Hackathon - Winner, RVITM, Bengaluru \n                  Parkinson\u2019s Disease Detection and Monitoring System Designed a system for early detection and monitoring of Parkinson\u2019s Disease using \n\nwearable sensors, AI algorithms, and blockchain to improve patient quality of life. \n\n\u25cf\u200b\nSEED'24 International Hackathon - 1st Prize, SEED Global Education \n                  Parkinson\u2019s Disease Detection and Monitoring System Designed a system for early detection and monitoring of Parkinson\u2019s Disease using \n\nwearable sensors, AI algorithms, and blockchain to improve patient quality of life. \n\n\u25cf\u200b\nCore Member, Tensor.ai \n                 Organized AI/ML hackathons, workshops, and technical events. Promoted research and project initiatives, and contributed to event planning, \n\nresource coordination, and mentoring.",
    "file_path": "data/uploads/20250602_090339_Resume new - Sneha Bhat.pdf",
    "parsed_at": "2025-06-02T09:07:29.547261",
    "parser_type": "OCR+AI"
  },
  {
    "id": "20250602_091406",
    "filename": "20250602_091242_Anirudh_resume - Anirudh Rai.pdf",
    "uploaded_at": "2025-06-01T06:00:37Z",
    "status": "parsed_and_stored",
    "uploaded_by": "pranamya-jain",
    "team": "Seeds! \ud83c\udf31",
    "name": "Anirudh S Rai",
    "email": "anirudhanirudh982@gmail.com",
    "phone": "+91-9945739677",
    "location": "anirudhsrai\n\nEducation\n\nRamaiah Institute of Technology, Bengaluru                                            ",
    "skills": [
      "Javascript",
      "Docker",
      "Github",
      "Mongodb",
      "Go",
      "Design",
      "React",
      "Sql",
      "R",
      "C++",
      "Java",
      "Python",
      "Node.Js",
      "Css",
      "Express",
      "Leadership",
      "Git",
      "Html"
    ],
    "experience": [
      {
        "title": "Skills\n\nProgramming",
        "company": "Hub",
        "duration": "Not specified",
        "description": "Details extracted from resume"
      }
    ],
    "education": [
      {
        "degree": "ma",
        "institution": "Institute",
        "year": "Not specified",
        "field": "Not specified"
      },
      {
        "degree": "ma",
        "institution": "Institute",
        "year": "Not specified",
        "field": "Not specified"
      }
    ],
    "experience_years": 0,
    "summary": "Anirudh S Rai\n   # anirudhanirudh982@gmail.com   \u0083 +91-9945739677    \u00a7 github.com/AnirudhRa1\n                    \u00ef https://tinyurl.com/anirudhsrai",
    "certifications": [],
    "languages": [],
    "projects": [],
    "raw_text": "Anirudh S Rai\n   # anirudhanirudh982@gmail.com   \u0083 +91-9945739677    \u00a7 github.com/AnirudhRa1\n                    \u00ef https://tinyurl.com/anirudhsrai\n\nEducation\n\nRamaiah Institute of Technology, Bengaluru                                            2022 \u2013 2026\n\n \u2022 Bachelor of Engineering, Computer Science & Engineering\n\n \u2022 GPA: 9.27/10\n\nSharada P.U College , Mangalore                                                     2020 \u2013 2022\n\n \u2022 Class XII (PCM), Grades: 92.6%\n\nInternships\n\nQuiz App                                                                              Oct 2023-Nov 2023\n\n \u2022 Completed a 3 week training program on Flutter.\n\n \u2022 Developed a Quiz App based on the popular quizzing app called QuizUp.\n\n \u2022 Gained hands-on experience with Flutter\u2019s widget-based architecture, and hot reload, while learning to build\n   responsive and cross-platform user interfaces.\n\nProjects\n\nPersonal Music Streaming App                                                             2024\n\n \u2022 Developed a personal music streaming app that allows users to upload, stream, and manage their own music\n    library.\n\n \u2022 Implemented secure authentication and a RESTful API to handle song metadata, streaming.\n\n \u2022 Containerized the entire application using Docker and deployed it for seamless access across devices.\n\n \u2022 Technologies: React, Node.js, Express.js, MongoDB, Docker\n\nDelivery App for College Students                                                          2024\n\n \u2022 Built a platform where students can post and accept delivery tasks within their college.\n\n \u2022 Designed a reward system where students earn points or money for completing deliveries.\n\n \u2022 Technologies: Flutter , Node.js, MongoDB.\n\nSkills\n\nProgramming Languages: C++, Python, Java, C, JavaScript,\nFrameworks/Tools: Node.js, Html, Css, Sql, Flutter, Express, MongoDB, Git, GitHub\nSoft Skills: Leadership,Time Management\n\nCompetitive Programming\n\n \u2022 CodeForces: Solved over 200 problems with Max Rating: 1432 , Best Global Rank: 973\n\n \u2022 LeetCode: Solved over 600 problems with, Best Global Rank: 1789\n\n \u2022 Achieved 1st place in the Republic Day Coding Contest held at my college.\nAnirudh S Rai\n\n# anirudhanirudh982@gmail.com\n\u0083 +91-9945739677\n\u00a7 github.com/AnirudhRa1\n\u00ef https://tinyurl.com/anirudhsrai\n\nEducation\n\nRamaiah Institute of Technology, Bengaluru\n2022 \u2013 2026\n\n\u2022 Bachelor of Engineering, Computer Science & Engineering\n\n\u2022 GPA: 9.27/10\n\nSharada P.U College , Mangalore\n2020 \u2013 2022\n\n\u2022 Class XII (PCM), Grades: 92.6%\n\nInternships\n\nQuiz App\nOct 2023-Nov 2023\n\n\u2022 Completed a 3 week training program on Flutter.\n\n\u2022 Developed a Quiz App based on the popular quizzing app called QuizUp.\n\n\u2022 Gained hands-on experience with Flutter\u2019s widget-based architecture, and hot reload, while learning to build\nresponsive and cross-platform user interfaces.\n\nProjects\n\nPersonal Music Streaming App\n2024\n\n\u2022 Developed a personal music streaming app that allows users to upload, stream, and manage their own music\nlibrary.\n\n\u2022 Implemented secure authentication and a RESTful API to handle song metadata, streaming.\n\n\u2022 Containerized the entire application using Docker and deployed it for seamless access across devices.\n\n\u2022 Technologies: React, Node.js, Express.js, MongoDB, Docker\n\nDelivery App for College Students\n2024\n\n\u2022 Built a platform where students can post and accept delivery tasks within their college.\n\n\u2022 Designed a reward system where students earn points or money for completing deliveries.\n\n\u2022 Technologies: Flutter , Node.js, MongoDB.\n\nSkills\n\nProgramming Languages: C++, Python, Java, C, JavaScript,\nFrameworks/Tools: Node.js, Html, Css, Sql, Flutter, Express, MongoDB, Git, GitHub\nSoft Skills: Leadership,Time Management\n\nCompetitive Programming\n\n\u2022 CodeForces: Solved over 200 problems with Max Rating: 1432 , Best Global Rank: 973\n\n\u2022 LeetCode: Solved over 600 problems with, Best Global Rank: 1789\n\n\u2022 Achieved 1st place in the Republic Day Coding Contest held at my college.",
    "file_path": "data/uploads/20250602_091242_Anirudh_resume - Anirudh Rai.pdf",
    "parsed_at": "2025-06-02T09:14:06.347974",
    "parser_type": "OCR+AI"
  },
  {
    "id": "20250602_091409",
    "filename": "20250602_091342_DHANRAJ_RATERIA_BE_FINAL (2) - Dhanraj Rateria.pdf",
    "uploaded_at": "2025-06-01T06:00:37Z",
    "status": "parsed_and_stored",
    "uploaded_by": "pranamya-jain",
    "team": "Seeds! \ud83c\udf31",
    "name": "Dhanraj Rateria",
    "email": "dhanrajrateria@gmail.com",
    "phone": "+91 8234012941",
    "location": "  Flutter, HT",
    "skills": [
      "Tensorflow",
      "R",
      "Devops",
      "Java",
      "Python",
      "Numpy",
      "Gcp",
      "Pytorch",
      "Flask",
      "Mysql",
      "Pandas",
      "Seaborn",
      "Css",
      "Html",
      "Windows",
      "Jenkins",
      "Bash",
      "Scikit-Learn",
      "Docker",
      "Github",
      "Go",
      "Design",
      "Sql",
      "React",
      "Azure",
      "Linux",
      "Aws",
      "Deep Learning",
      "Leadership",
      "Git"
    ],
    "experience": [
      {
        "title": "Content Writer and Social Media Manager",
        "company": "Major Projects",
        "duration": "Not specified",
        "description": "Details extracted from resume"
      }
    ],
    "education": [
      {
        "degree": "ma",
        "institution": "Institute",
        "year": "Not specified",
        "field": "Not specified"
      },
      {
        "degree": "ma",
        "institution": "Institute",
        "year": "Not specified",
        "field": "Not specified"
      }
    ],
    "experience_years": 0,
    "summary": "R dhanrajrateria@gmail.com | R 1ms22cy020@msrit.edu | \u00d3 +91 8234012941 | \u00bd Bengaluru, India\n    \u0087 GitHub | \u00af LinkedIn | / LeetCode | \uf1c0Kaggle | / CodeForces | 7 Twitter | 2 Hugging Face | \u008c Portfolio",
    "certifications": [],
    "languages": [],
    "projects": [],
    "raw_text": "Dhanraj Rateria\n\n      R dhanrajrateria@gmail.com | R 1ms22cy020@msrit.edu | \u00d3 +91 8234012941 | \u00bd Bengaluru, India\n    \u0087 GitHub | \u00af LinkedIn | / LeetCode | \uf1c0Kaggle | / CodeForces | 7 Twitter | 2 Hugging Face | \u008c Portfolio\n\nEducation\n\u2022 BE, Computer Science & Engineering (Cyber Security), Ramaiah Institute Of Technology, Bengaluru   2026\n CGPA or CPI: 9.3/10.0\n\u2022 Senior Secondary (XII), Science, O.P. Jindal School Patrapali, Raigarh                                2022\n  Percentage: 96.00% (CBSE board)\n\u2022 Secondary (X), O.P. Jindal School Patrapali, Raigarh                                                  2020\n  Percentage: 98.00% (CBSE board)\n\nTechnical Skills                     Relevant Coursework\nProgramming: Python, C, Java, Bash Operating Sys-  Engineering Mathematics, Operating Systems, Data Struc-\ntems: Windows, Linux ML & Data Processing: Ten-  tures and Algorithms, Database Management Systems,\nsorFlow, PyTorch, Scikit-learn, Numpy, Pandas, Seaborn  Computer Networks, Computer  Architecture,  Compiler\nWeb & Mobile:  Flutter, HTML, CSS, ReactJS, Nex-  Design,  Automata  Theory,  UNIX, AWS  Fundamen-\ntJS Backend & DevOps:  Flask, NodeJS, Docker, Ku-  tals,Software Engineering, Natural Language Processing,\nbernetes, Git,CI/CD(Jenkins), Prometheus, Hadoop, Spark  Deep Learning, TensorFlow Development, Machine Learn-\nCloud: GCP, AWS (EKS, ECS), Azure Database: Mon-  ing, Cryptography\ngoDB, MySQL, Firebase Quantum Computing: Qiskit,\nQuantum Algorithms, Quantum Circuits\n\nProfessional Experience\n\u2022 Hewlett Packard Enterprise (HPE)\n  \u2013 CPP Research Project Intern, Feb, 2025 - Present\n    \u2217Working on developing AI-powered Quantum Resistant Cryptographic Algorithms\n   \u2217Aiming to achieve 90% efficiency compared to traditional algorithms\n\n  \u2013 Research Project Intern, Feb, 2024 - Oct, 2024\n   \u2217ASTRA SIM Research, optimizing 50+ configuration combinations for 100+ models, reducing overhead by 30%\n    \u2217Analyzed performance metrics to enhance distributed training, boosting model convergence speed by 15%\n\n\u2022 Unisys\n  \u2013 Research Project Intern, Nov, 2024 - Present\n    \u2217Developed an Intelligent Assistant simplifying the process of generating and modifying product configurations\n   \u2217Worked with XML files with over 3000 configurations and attributes, optimizing generation and matching\n\nLeadership & Volunteer Experience\n\u2022 IEEE RIT, Bangalore,\n  \u2013 Treasurer, IEEE Computer Society (2023 - Present)\n  \u2013 Execom, IEEE Web Resources (2022 - 2023)\n\n\u2022 Entrepreneurship Development Cell, RIT Bangalore,\n  \u2013 IT Head (2024 - Present)\n  \u2013 Content Writer and Social Media Manager (2023 - 2024)\n\nMajor Projects\n\u2022 ASTRA-SIM Research Project, HPE Industry Collaboration, Report                      Feb, 2024 - Oct, 2024\n  \u2013 ASTRA SIM Research, optimizing 50+ configuration combinations for 100+ models, reducing overhead by 30%\n\n\u2022 Quantum Federated Learning Simulator, GitHub                                  Mar, 2025 - May, 2025\n  \u2013 Achieved a comparative study and 90% efficiency and 50% improvement in precision in the use of a federated\n    quantum learning environment to train ML models.\n\n\u2022 ML Based CAPTCHA: Redifining UIDAI website(SIH, 2024), GitHub             Aug 2024 - Oct 2024\n  \u2013 Developed a 95 % accurate CAPTCHA based on user parameters fed into an ML model for GOI (ReactJS, Tensor-\n    Flow, Selenium)\n\n\u2022 Rahasya: A Dark Pattern Detector Tool(DPBH, 2024), GitHub                    Dec 2023 - Feb 2024\n  \u2013 Developed an NLP and vision based Dark Patter detector for more than 20 Dark Patterns\n\n\u2022 Logistics Application for Small Businesses(Solve for India, 2023), GitHub            Jan 2023 - Jun 2023\n  \u2013 Developed a blockchain based real time logistics management application using Flutter and Solidity\n\n1\nDhanraj Rateria\n\nR dhanrajrateria@gmail.com | R 1ms22cy020@msrit.edu | \u00d3 +91 8234012941 | \u00bd Bengaluru, India\n\u0087 GitHub | \u00af LinkedIn | / LeetCode | \uf1c0Kaggle | / CodeForces | 7 Twitter | 2 Hugging Face | \u008c Portfolio\n\nEducation\n\n\u2022 BE, Computer Science & Engineering (Cyber Security), Ramaiah Institute Of Technology, Bengaluru\n2026\nCGPA or CPI: 9.3/10.0\n\u2022 Senior Secondary (XII), Science, O.P. Jindal School Patrapali, Raigarh\n2022\nPercentage: 96.00% (CBSE board)\n\u2022 Secondary (X), O.P. Jindal School Patrapali, Raigarh\n2020\nPercentage: 98.00% (CBSE board)\n\nTechnical Skills\nProgramming: Python, C, Java, Bash Operating Sys-\ntems: Windows, Linux ML & Data Processing: Ten-\nsorFlow, PyTorch, Scikit-learn, Numpy, Pandas, Seaborn\nWeb & Mobile:\nFlutter, HTML, CSS, ReactJS, Nex-\ntJS Backend & DevOps: Flask, NodeJS, Docker, Ku-\nbernetes, Git,CI/CD(Jenkins), Prometheus, Hadoop, Spark\nCloud: GCP, AWS (EKS, ECS), Azure Database: Mon-\ngoDB, MySQL, Firebase Quantum Computing: Qiskit,\nQuantum Algorithms, Quantum Circuits\n\nRelevant Coursework\nEngineering Mathematics, Operating Systems, Data Struc-\ntures and Algorithms, Database Management Systems,\nComputer Networks, Computer Architecture, Compiler\nDesign,\nAutomata\nTheory,\nUNIX,\nAWS\nFundamen-\ntals,Software Engineering, Natural Language Processing,\nDeep Learning, TensorFlow Development, Machine Learn-\ning, Cryptography\n\nProfessional Experience\n\n\u2022 Hewlett Packard Enterprise (HPE)\n\n\u2013 CPP Research Project Intern, Feb, 2025 - Present\n\n\u2217Working on developing AI-powered Quantum Resistant Cryptographic Algorithms\n\u2217Aiming to achieve 90% efficiency compared to traditional algorithms\n\n\u2013 Research Project Intern, Feb, 2024 - Oct, 2024\n\n\u2217ASTRA SIM Research, optimizing 50+ configuration combinations for 100+ models, reducing overhead by 30%\n\u2217Analyzed performance metrics to enhance distributed training, boosting model convergence speed by 15%\n\n\u2022 Unisys\n\n\u2013 Research Project Intern, Nov, 2024 - Present\n\n\u2217Developed an Intelligent Assistant simplifying the process of generating and modifying product configurations\n\u2217Worked with XML files with over 3000 configurations and attributes, optimizing generation and matching\n\nLeadership & Volunteer Experience\n\u2022 IEEE RIT, Bangalore,\n\n\u2013 Treasurer, IEEE Computer Society (2023 - Present)\n\u2013 Execom, IEEE Web Resources (2022 - 2023)\n\n\u2022 Entrepreneurship Development Cell, RIT Bangalore,\n\n\u2013 IT Head (2024 - Present)\n\u2013 Content Writer and Social Media Manager (2023 - 2024)\n\nMajor Projects\n\u2022 ASTRA-SIM Research Project, HPE Industry Collaboration, Report\nFeb, 2024 - Oct, 2024\n\u2013 ASTRA SIM Research, optimizing 50+ configuration combinations for 100+ models, reducing overhead by 30%\n\n\u2022 Quantum Federated Learning Simulator, GitHub\nMar, 2025 - May, 2025\n\u2013 Achieved a comparative study and 90% efficiency and 50% improvement in precision in the use of a federated\nquantum learning environment to train ML models.\n\n\u2022 ML Based CAPTCHA: Redifining UIDAI website(SIH, 2024), GitHub\nAug 2024 - Oct 2024\n\u2013 Developed a 95 % accurate CAPTCHA based on user parameters fed into an ML model for GOI (ReactJS, Tensor-\nFlow, Selenium)\n\n\u2022 Rahasya: A Dark Pattern Detector Tool(DPBH, 2024), GitHub\nDec 2023 - Feb 2024\n\u2013 Developed an NLP and vision based Dark Patter detector for more than 20 Dark Patterns\n\n\u2022 Logistics Application for Small Businesses(Solve for India, 2023), GitHub\nJan 2023 - Jun 2023\n\u2013 Developed a blockchain based real time logistics management application using Flutter and Solidity\n\n1\n\nMinor Projects\nMonitoring systems and scaling, pipeline and incident management applications, mathematical concepts(Trasformers,\nNIST papers etc.)  implementation from scratch.  Quantitative finance concepts and uses.  Breaking down computer\nscience concepts(operating systems, technical frameworks and their uses). Frontend and Backend daily web applications.\nPortfolio for details.\n\u2022 Technical blogs\n\u2022 Non-technical blogs\nAchievements\n\u2022 Winner, Smart India Hackathon 2024 (Intra-college)\n\u2022 Winner, Smart India Hackathon 2023 (Intra-college)\n\u2022 Winner, Solving for India Hackathon 2023 (Inter-college)\n\u2022 Regional Round Winner, Dark Pattern Buster Hackathon 2024\n\u2022 Regional Round Winner, SAP Hackfest 2024\n\u2022 2nd runner-up, Leadership Unleashed, TAPMI 2025\n\u2022 Active contributor on LeetCode and CodeForces, solving complex algorithmic problems\n\n2\nMinor Projects\n\nMonitoring systems and scaling, pipeline and incident management applications, mathematical concepts(Trasformers,\nNIST papers etc.) implementation from scratch. Quantitative finance concepts and uses. Breaking down computer\nscience concepts(operating systems, technical frameworks and their uses). Frontend and Backend daily web applications.\nPortfolio for details.\n\u2022 Technical blogs\n\u2022 Non-technical blogs\nAchievements\n\n\u2022 Winner, Smart India Hackathon 2024 (Intra-college)\n\u2022 Winner, Smart India Hackathon 2023 (Intra-college)\n\u2022 Winner, Solving for India Hackathon 2023 (Inter-college)\n\u2022 Regional Round Winner, Dark Pattern Buster Hackathon 2024\n\u2022 Regional Round Winner, SAP Hackfest 2024\n\u2022 2nd runner-up, Leadership Unleashed, TAPMI 2025\n\u2022 Active contributor on LeetCode and CodeForces, solving complex algorithmic problems\n\n2",
    "file_path": "data/uploads/20250602_091342_DHANRAJ_RATERIA_BE_FINAL (2) - Dhanraj Rateria.pdf",
    "parsed_at": "2025-06-02T09:14:09.900203",
    "parser_type": "OCR+AI"
  },
  {
    "id": "20250602_095602",
    "filename": "20250602_095555_DhavalaT S_InternshalaResume-17 - DHAVALA T S.pdf",
    "uploaded_at": "2025-06-01T06:00:37Z",
    "status": "parsed_and_stored",
    "uploaded_by": "pranamya-jain",
    "team": "Seeds! \ud83c\udf31",
    "name": "Dhavala T S",
    "email": "tsdhavala@gmail.com",
    "phone": "+91 8762880502",
    "location": "Bangalore",
    "skills": [
      "Python",
      "Data Analytics",
      "MS-Excel",
      "Machine Learning",
      "Deep Learning",
      "Neural Networks",
      "English Proficiency (Written)",
      "English Proficiency (Spoken)",
      "Data Science",
      "SQL",
      "Natural Language Processing (NLP)",
      "Algorithms",
      "R Programming",
      "Data Structures",
      "MS-PowerPoint",
      "Power BI",
      "Microsoft Azure",
      "HTML",
      "CSS"
    ],
    "experience": [
      {
        "title": "Research \u2022 Internship",
        "company": "Samsung R &D Institute",
        "duration": "Sep 2024 - Present",
        "description": "As a research intern, I'm working on automation of post link optimization in Linux x86 and Android ARM 64 primarily via profile guided optimization(PGO), using Python for automation and Gtest, ADB. Also using technologies such as LTO and BOLT."
      },
      {
        "title": "Data Science \u2022 Internship",
        "company": "Oasis Infobyte",
        "duration": "Aug 2024 - Present",
        "description": "Worked on projects like flower classification in iris dataset, Unemployment analysis, car price prediction, SMS spam filtering and sales prediction using relevant Machine Learning techniques"
      },
      {
        "title": "Python Development \u2022 Internship",
        "company": "Octanet Services Private Limited",
        "duration": "Aug 2024",
        "description": "Worked on an ATM simulation in Google colab which takes input of ATM pin and checks pin , withdrawal of money, deposit money, check balance, change pin."
      },
      {
        "title": "Data Science \u2022 Internship",
        "company": "Codeclause Private Limited",
        "duration": "Aug 2024 - Sep 2024",
        "description": "As an intern at Codeclause,I developed a ML model to detect fraudulent activities in credit card transactions(task 1),an advanced model using XGBoost for the same and golden project- heart disease prediction(random forest) with streamlit UI"
      }
    ],
    "education": [
      {
        "degree": "Bachelor of Engineering (B.E)",
        "institution": "Ramaiah Institute Of Technology",
        "year": "2022 - 2026",
        "field": "Data Science"
      }
    ],
    "experience_years": 0,
    "summary": "Aspiring data scientist with expertise in machine learning, data analysis, and predictive modeling.",
    "certifications": [
      "Artificial Intelligence",
      "Data Science",
      "Microsoft Azure Data Fundamentals Cloud Skills Challenge",
      "Microsoft Azure AI Fundamentals Cloud Skills Challenge",
      "AI"
    ],
    "languages": [],
    "projects": [
      {
        "name": "Heart disease prediction",
        "description": "This project aims to predict the likelihood of heart disease based on various health metrics input by the user. Using a user-friendly interface built with Streamlit, users can enter data such as age, sex, cholesterol levels, and more. The system processes this input and utilizes a Random Forest Classifier (built using Scikit-Learn) to assess the risk of heart disease.\n\nKey features include:\n\nA clean and intuitive UI for health data input.\nReal-time prediction using a pre-trained machine learning model.\nSeamless integration of data preprocessing and model inference.\nTechnologies used: Python, Streamlit, Scikit-Learn, Pandas, Joblib, and NumPy.\n\nThis project enhances the understanding of cardiovascular risk factors and demonstrates the practical application of predictive models in healthcare.",
        "technologies": [
          "Python",
          "Streamlit",
          "Scikit-Learn",
          "Pandas",
          "Joblib",
          "NumPy"
        ]
      },
      {
        "name": "Parkinson's Episode Prediction System",
        "description": "Developed an AI system to predict the off episodes of Parkinson's disease based on parameters like Alpha synuclein dopamine and sp02",
        "technologies": []
      },
      {
        "name": "Green chips",
        "description": "Developed an effective E-waste management system which helps people connect with E-waste disposal centres and helps disposers get an estimate of the money they might get based on uploading pictures of the e-waste they are about to dispose",
        "technologies": []
      }
    ],
    "raw_text": "Dhavala T S\n\ntsdhavala@gmail.com | +91 8762880502 | Bangalore\n\nCAREER OBJECTIVE\n\nAspiring data scientist with expertise in machine learning, data analysis, and predictive modeling.\n\nWORK EXPERIENCE\n\nResearch \u2022 Internship                                                                        Sep 2024 - Present\nSamsung R &D Institute, Virtual\n\nAs a research intern, I'm working on automation of post link optimization in Linux x86 and Android ARM 64 primarily via profile guided\noptimization(PGO), using Python for automation and Gtest, ADB. Also using technologies such as LTO and BOLT.\n\nData Science \u2022 Internship                                                                   Aug 2024 - Present\nOasis Infobyte, Virtual\n\nWorked on projects like flower classification in iris dataset, Unemployment analysis, car price prediction, SMS spam filtering and sales\nprediction using relevant Machine Learning techniques\n\nPython Development \u2022 Internship                                                                    Aug 2024\nOctanet Services Private Limited, Virtual\n\nWorked on an ATM simulation in Google colab which takes input of ATM pin and checks pin , withdrawal of money, deposit money,\ncheck balance, change pin.\n\nData Science \u2022 Internship                                                                 Aug 2024 - Sep 2024\nCodeclause Private Limited, Virtual\n\nAs an intern at Codeclause,I developed a ML model to detect fraudulent activities in credit card transactions(task 1),an advanced model\nusing XGBoost for the same and golden project- heart disease prediction(random forest) with streamlit UI\n\nEDUCATION\n\nBachelor of Engineering (B.E), Data Science                                                           2022 - 2026\nRamaiah Institute Of Technology\n\nTRAININGS / CERTIFICATIONS\n\nArtificial Intelligence                                      Data Science\nJul 2024 - Present                                       Mar 2024\n\nInfosys Springboard, Virtual                                                 Skillsoft, Virtual\n\nSelected as a part of Pragati program of Infosys Springboard\n(cohort 2)\n\nMicrosoft Azure Data Fundamentals Cloud Skills               Microsoft Azure AI Fundamentals Cloud Skills\nChallenge                                                 Challenge\nFeb 2024 - Mar 2024                                        Jan 2024\n\nMicrosoft, Virtual                                                    Microsoft, Virtual\n\nParticipated in students ambassador clouds skills challenge on     Was an active skills challenge on Microsoft Learn. Got to learn\nData science concepts and earned badges and certificate.        new essential skills and earned badges and certificates.\n\nAI\nDec 2023\n\nSkill Nation, Virtual\n\nGained experience in a workshop for ChatGPT prompts and use\nof various AI tools\n\nPORTFOLIO\n\nPage - 1/3\nDhavala T S\n\ntsdhavala@gmail.com |  +91 8762880502 | Bangalore\n\nCAREER OBJECTIVE\n\nAspiring data scientist with expertise in machine learning, data analysis, and predictive modeling.\n\nWORK EXPERIENCE\n\nResearch \u2022 Internship\nSep 2024 - Present\nSamsung R &D Institute, Virtual\n\nAs a research intern, I'm working on automation of post link optimization in Linux x86 and Android ARM 64 primarily via profile guided\noptimization(PGO), using Python for automation and Gtest, ADB. Also using technologies such as LTO and BOLT.\n\nData Science \u2022 Internship\nAug 2024 - Present\nOasis Infobyte, Virtual\n\nWorked on projects like flower classification in iris dataset, Unemployment analysis, car price prediction, SMS spam filtering and sales\nprediction using relevant Machine Learning techniques\n\nPython Development \u2022 Internship\nAug 2024\nOctanet Services Private Limited, Virtual\n\nWorked on an ATM simulation in Google colab which takes input of ATM pin and checks pin , withdrawal of money, deposit money,\ncheck balance, change pin.\n\nData Science \u2022 Internship\nAug 2024 - Sep 2024\nCodeclause Private Limited, Virtual\n\nAs an intern at Codeclause,I developed a ML model to detect fraudulent activities in credit card transactions(task 1),an advanced model\nusing XGBoost for the same and golden project- heart disease prediction(random forest) with streamlit UI\n\nEDUCATION\n\nBachelor of Engineering (B.E), Data Science\n2022 - 2026\nRamaiah Institute Of Technology\n\nTRAININGS / CERTIFICATIONS\n\nArtificial Intelligence\nJul 2024 - Present\n\nData Science\nMar 2024\n\nInfosys Springboard, Virtual\n\nSkillsoft, Virtual\n\nSelected as a part of Pragati program of Infosys Springboard\n(cohort 2)\n\nMicrosoft Azure Data Fundamentals Cloud Skills\nChallenge\nFeb 2024 - Mar 2024\n\nMicrosoft Azure AI Fundamentals Cloud Skills\nChallenge\nJan 2024\n\nMicrosoft, Virtual\n\nMicrosoft, Virtual\n\nParticipated in students ambassador clouds skills challenge on\nData science concepts and earned badges and certificate.\n\nWas an active skills challenge on Microsoft Learn. Got to learn\nnew essential skills and earned badges and certificates.\n\nAI\nDec 2023\n\nSkill Nation, Virtual\n\nGained experience in a workshop for ChatGPT prompts and use\nof various AI tools\n\nPORTFOLIO\n\nPage - 1/3\n\nGitHub link \u2197\n\nPortfolio link \u2197\n\nKaggle link \u2197\n\nCodeChef link \u2197\n\nLeetcode link \u2197\n\nHackerRank link \u2197\n\nPROJECTS\n\nHeart disease prediction \u2197                                    Parkinson's Episode Prediction System \u2197\nAug 2024 - Sep 2024                                     Mar 2024 - Jun 2024\nHeart Disease Prediction System Using Machine Learning          Developed an AI system to predict the off episodes of\n                                                                  Parkinson's disease based on parameters like Alpha synuclein\nThis project aims to predict the likelihood of heart disease based    dopamine and sp02\non various health metrics input by the user. Using a user-friendly\ninterface built with Streamlit, users can enter data such as age,\nsex, cholesterol levels, and more. The system processes this\ninput and utilizes a Random Forest Classifier (built using Scikit-\nLearn) to assess the risk of heart disease.\n\nKey features include:\n\nA clean and intuitive UI for health data input.\nReal-time prediction using a pre-trained machine learning model.\nSeamless integration of data preprocessing and model inference.\nTechnologies used: Python, Streamlit, Scikit-Learn, Pandas,\nJoblib, and NumPy.\n\nThis project enhances the understanding of cardiovascular risk\nfactors and demonstrates the practical application of predictive\nmodels in healthcare.\n\nGreen chips \u2197\nSep 2023 - Nov 2023\nDeveloped an effective E-waste management system which\nhelps people connect with E-waste disposal centres and helps\ndisposers get an estimate of the money they might get based on\nuploading pictures of the e-waste they are about to dispose\n\nSKILLS\n\n\u2022 Python                               \u2022 Data Analytics                         \u2022 MS-Excel\n\n\u2022 Machine Learning                      \u2022 Deep Learning                         \u2022 Neural Networks\n\n\u2022 English Proficiency (Written)             \u2022 English Proficiency (Spoken)             \u2022 Data Science\n\n\u2022 SQL                                 \u2022 Natural Language Processing (NLP)       \u2022 Algorithms\n\n\u2022 R Programming                        \u2022 Data Structures                        \u2022 MS-PowerPoint\n\n\u2022 Power BI                             \u2022 Microsoft Azure                        \u2022 HTML\n\n\u2022 CSS\n\nEXTRA CURRICULAR ACTIVITIES\n\n  An active member of the IEEE Computer Society club of Msrit which hosts technical events\n  Also an active member of NSS club\n\nADDITIONAL DETAILS\n\n  Won first in FantomCode'24 held during 16-17th may in RVITM cracked the ideation round to be a part of the 24 hour hackathon We\n  worked on AI driven Parkinsons off episode prediction based on the chemicals such as alpha-synuclein, dopamine and spO2\n\nPage - 2/3\nGitHub link \u2197\n\nPortfolio link \u2197\n\nKaggle link \u2197\n\nCodeChef link \u2197\n\nLeetcode link \u2197\n\nHackerRank link \u2197\n\nPROJECTS\n\nHeart disease prediction \u2197 \nAug 2024 - Sep 2024\n\nParkinson's Episode Prediction System \u2197 \nMar 2024 - Jun 2024\n\nHeart Disease Prediction System Using Machine Learning\n\nDeveloped an AI system to predict the off episodes of\nParkinson's disease based on parameters like Alpha synuclein\ndopamine and sp02\n\nThis project aims to predict the likelihood of heart disease based\non various health metrics input by the user. Using a user-friendly\ninterface built with Streamlit, users can enter data such as age,\nsex, cholesterol levels, and more. The system processes this\ninput and utilizes a Random Forest Classifier (built using Scikit-\nLearn) to assess the risk of heart disease.\n\nKey features include:\n\nA clean and intuitive UI for health data input.\nReal-time prediction using a pre-trained machine learning model.\nSeamless integration of data preprocessing and model inference.\nTechnologies used: Python, Streamlit, Scikit-Learn, Pandas,\nJoblib, and NumPy.\n\nThis project enhances the understanding of cardiovascular risk\nfactors and demonstrates the practical application of predictive\nmodels in healthcare.\n\nGreen chips \u2197 \nSep 2023 - Nov 2023\n\nDeveloped an effective E-waste management system which\nhelps people connect with E-waste disposal centres and helps\ndisposers get an estimate of the money they might get based on\nuploading pictures of the e-waste they are about to dispose\n\nSKILLS\n\n\u2022\u00a0 Python\n\u2022\u00a0 Data Analytics\n\u2022\u00a0 MS-Excel\n\n\u2022\u00a0 Machine Learning\n\u2022\u00a0 Deep Learning\n\u2022\u00a0 Neural Networks\n\n\u2022\u00a0 English Proficiency (Written)\n\u2022\u00a0 English Proficiency (Spoken)\n\u2022\u00a0 Data Science\n\n\u2022\u00a0 SQL\n\u2022\u00a0 Natural Language Processing (NLP)\n\u2022\u00a0 Algorithms\n\n\u2022\u00a0 R Programming\n\u2022\u00a0 Data Structures\n\u2022\u00a0 MS-PowerPoint\n\n\u2022\u00a0 Power BI\n\u2022\u00a0 Microsoft Azure\n\u2022\u00a0 HTML\n\n\u2022\u00a0 CSS\n\nEXTRA CURRICULAR ACTIVITIES\n\nAn active member of the IEEE Computer Society club of Msrit which hosts technical events\nAlso an active member of NSS club\n\nADDITIONAL DETAILS\n\nWon first in FantomCode'24 held during 16-17th may in RVITM cracked the ideation round to be a part of the 24 hour hackathon We\nworked on AI driven Parkinsons off episode prediction based on the chemicals such as alpha-synuclein, dopamine and spO2\n\nPage - 2/3\n\nExtracurricular Leadership Experience: Execom Member, IEEE Computer Society Jan 2024 \u2013 Present Organized technical events like\ndebugathons, and coding competitions. Coordinated workshops and seminars on emerging technologies\n\nPage - 3/3\nExtracurricular Leadership Experience: Execom Member, IEEE Computer Society Jan 2024 \u2013 Present Organized technical events like\ndebugathons, and coding competitions. Coordinated workshops and seminars on emerging technologies\n\nPage - 3/3",
    "file_path": "data/uploads/20250602_095555_DhavalaT S_InternshalaResume-17 - DHAVALA T S.pdf",
    "parsed_at": "2025-06-02T09:56:02.011147",
    "parser_type": "OCR+AI"
  },
  {
    "id": "20250602_091409",
    "filename": "20250602_091342_DHANRAJ_RATERIA_BE_FINAL (2) - Dhanraj Rateria.pdf",
    "uploaded_at": "2025-06-01T06:00:37Z",
    "status": "parsed_and_stored",
    "uploaded_by": "pranamya-jain",
    "team": "Seeds! \ud83c\udf31",
    "name": "Dhanraj Rateria",
    "email": "dhanrajrateria@gmail.com",
    "phone": "+91 8234012941",
    "location": "  Flutter, HT",
    "skills": [
      "Tensorflow",
      "R",
      "Devops",
      "Java",
      "Python",
      "Numpy",
      "Gcp",
      "Pytorch",
      "Flask",
      "Mysql",
      "Pandas",
      "Seaborn",
      "Css",
      "Html",
      "Windows",
      "Jenkins",
      "Bash",
      "Scikit-Learn",
      "Docker",
      "Github",
      "Go",
      "Design",
      "Sql",
      "React",
      "Azure",
      "Linux",
      "Aws",
      "Deep Learning",
      "Leadership",
      "Git"
    ],
    "experience": [
      {
        "title": "Content Writer and Social Media Manager",
        "company": "Major Projects",
        "duration": "Not specified",
        "description": "Details extracted from resume"
      }
    ],
    "education": [
      {
        "degree": "ma",
        "institution": "Institute",
        "year": "Not specified",
        "field": "Not specified"
      },
      {
        "degree": "ma",
        "institution": "Institute",
        "year": "Not specified",
        "field": "Not specified"
      }
    ],
    "experience_years": 0,
    "summary": "R dhanrajrateria@gmail.com | R 1ms22cy020@msrit.edu | \u00d3 +91 8234012941 | \u00bd Bengaluru, India\n    \u0087 GitHub | \u00af LinkedIn | / LeetCode | \uf1c0Kaggle | / CodeForces | 7 Twitter | 2 Hugging Face | \u008c Portfolio",
    "certifications": [],
    "languages": [],
    "projects": [],
    "raw_text": "Dhanraj Rateria\n\n      R dhanrajrateria@gmail.com | R 1ms22cy020@msrit.edu | \u00d3 +91 8234012941 | \u00bd Bengaluru, India\n    \u0087 GitHub | \u00af LinkedIn | / LeetCode | \uf1c0Kaggle | / CodeForces | 7 Twitter | 2 Hugging Face | \u008c Portfolio\n\nEducation\n\u2022 BE, Computer Science & Engineering (Cyber Security), Ramaiah Institute Of Technology, Bengaluru   2026\n CGPA or CPI: 9.3/10.0\n\u2022 Senior Secondary (XII), Science, O.P. Jindal School Patrapali, Raigarh                                2022\n  Percentage: 96.00% (CBSE board)\n\u2022 Secondary (X), O.P. Jindal School Patrapali, Raigarh                                                  2020\n  Percentage: 98.00% (CBSE board)\n\nTechnical Skills                     Relevant Coursework\nProgramming: Python, C, Java, Bash Operating Sys-  Engineering Mathematics, Operating Systems, Data Struc-\ntems: Windows, Linux ML & Data Processing: Ten-  tures and Algorithms, Database Management Systems,\nsorFlow, PyTorch, Scikit-learn, Numpy, Pandas, Seaborn  Computer Networks, Computer  Architecture,  Compiler\nWeb & Mobile:  Flutter, HTML, CSS, ReactJS, Nex-  Design,  Automata  Theory,  UNIX, AWS  Fundamen-\ntJS Backend & DevOps:  Flask, NodeJS, Docker, Ku-  tals,Software Engineering, Natural Language Processing,\nbernetes, Git,CI/CD(Jenkins), Prometheus, Hadoop, Spark  Deep Learning, TensorFlow Development, Machine Learn-\nCloud: GCP, AWS (EKS, ECS), Azure Database: Mon-  ing, Cryptography\ngoDB, MySQL, Firebase Quantum Computing: Qiskit,\nQuantum Algorithms, Quantum Circuits\n\nProfessional Experience\n\u2022 Hewlett Packard Enterprise (HPE)\n  \u2013 CPP Research Project Intern, Feb, 2025 - Present\n    \u2217Working on developing AI-powered Quantum Resistant Cryptographic Algorithms\n   \u2217Aiming to achieve 90% efficiency compared to traditional algorithms\n\n  \u2013 Research Project Intern, Feb, 2024 - Oct, 2024\n   \u2217ASTRA SIM Research, optimizing 50+ configuration combinations for 100+ models, reducing overhead by 30%\n    \u2217Analyzed performance metrics to enhance distributed training, boosting model convergence speed by 15%\n\n\u2022 Unisys\n  \u2013 Research Project Intern, Nov, 2024 - Present\n    \u2217Developed an Intelligent Assistant simplifying the process of generating and modifying product configurations\n   \u2217Worked with XML files with over 3000 configurations and attributes, optimizing generation and matching\n\nLeadership & Volunteer Experience\n\u2022 IEEE RIT, Bangalore,\n  \u2013 Treasurer, IEEE Computer Society (2023 - Present)\n  \u2013 Execom, IEEE Web Resources (2022 - 2023)\n\n\u2022 Entrepreneurship Development Cell, RIT Bangalore,\n  \u2013 IT Head (2024 - Present)\n  \u2013 Content Writer and Social Media Manager (2023 - 2024)\n\nMajor Projects\n\u2022 ASTRA-SIM Research Project, HPE Industry Collaboration, Report                      Feb, 2024 - Oct, 2024\n  \u2013 ASTRA SIM Research, optimizing 50+ configuration combinations for 100+ models, reducing overhead by 30%\n\n\u2022 Quantum Federated Learning Simulator, GitHub                                  Mar, 2025 - May, 2025\n  \u2013 Achieved a comparative study and 90% efficiency and 50% improvement in precision in the use of a federated\n    quantum learning environment to train ML models.\n\n\u2022 ML Based CAPTCHA: Redifining UIDAI website(SIH, 2024), GitHub             Aug 2024 - Oct 2024\n  \u2013 Developed a 95 % accurate CAPTCHA based on user parameters fed into an ML model for GOI (ReactJS, Tensor-\n    Flow, Selenium)\n\n\u2022 Rahasya: A Dark Pattern Detector Tool(DPBH, 2024), GitHub                    Dec 2023 - Feb 2024\n  \u2013 Developed an NLP and vision based Dark Patter detector for more than 20 Dark Patterns\n\n\u2022 Logistics Application for Small Businesses(Solve for India, 2023), GitHub            Jan 2023 - Jun 2023\n  \u2013 Developed a blockchain based real time logistics management application using Flutter and Solidity\n\n1\nDhanraj Rateria\n\nR dhanrajrateria@gmail.com | R 1ms22cy020@msrit.edu | \u00d3 +91 8234012941 | \u00bd Bengaluru, India\n\u0087 GitHub | \u00af LinkedIn | / LeetCode | \uf1c0Kaggle | / CodeForces | 7 Twitter | 2 Hugging Face | \u008c Portfolio\n\nEducation\n\n\u2022 BE, Computer Science & Engineering (Cyber Security), Ramaiah Institute Of Technology, Bengaluru\n2026\nCGPA or CPI: 9.3/10.0\n\u2022 Senior Secondary (XII), Science, O.P. Jindal School Patrapali, Raigarh\n2022\nPercentage: 96.00% (CBSE board)\n\u2022 Secondary (X), O.P. Jindal School Patrapali, Raigarh\n2020\nPercentage: 98.00% (CBSE board)\n\nTechnical Skills\nProgramming: Python, C, Java, Bash Operating Sys-\ntems: Windows, Linux ML & Data Processing: Ten-\nsorFlow, PyTorch, Scikit-learn, Numpy, Pandas, Seaborn\nWeb & Mobile:\nFlutter, HTML, CSS, ReactJS, Nex-\ntJS Backend & DevOps: Flask, NodeJS, Docker, Ku-\nbernetes, Git,CI/CD(Jenkins), Prometheus, Hadoop, Spark\nCloud: GCP, AWS (EKS, ECS), Azure Database: Mon-\ngoDB, MySQL, Firebase Quantum Computing: Qiskit,\nQuantum Algorithms, Quantum Circuits\n\nRelevant Coursework\nEngineering Mathematics, Operating Systems, Data Struc-\ntures and Algorithms, Database Management Systems,\nComputer Networks, Computer Architecture, Compiler\nDesign,\nAutomata\nTheory,\nUNIX,\nAWS\nFundamen-\ntals,Software Engineering, Natural Language Processing,\nDeep Learning, TensorFlow Development, Machine Learn-\ning, Cryptography\n\nProfessional Experience\n\n\u2022 Hewlett Packard Enterprise (HPE)\n\n\u2013 CPP Research Project Intern, Feb, 2025 - Present\n\n\u2217Working on developing AI-powered Quantum Resistant Cryptographic Algorithms\n\u2217Aiming to achieve 90% efficiency compared to traditional algorithms\n\n\u2013 Research Project Intern, Feb, 2024 - Oct, 2024\n\n\u2217ASTRA SIM Research, optimizing 50+ configuration combinations for 100+ models, reducing overhead by 30%\n\u2217Analyzed performance metrics to enhance distributed training, boosting model convergence speed by 15%\n\n\u2022 Unisys\n\n\u2013 Research Project Intern, Nov, 2024 - Present\n\n\u2217Developed an Intelligent Assistant simplifying the process of generating and modifying product configurations\n\u2217Worked with XML files with over 3000 configurations and attributes, optimizing generation and matching\n\nLeadership & Volunteer Experience\n\u2022 IEEE RIT, Bangalore,\n\n\u2013 Treasurer, IEEE Computer Society (2023 - Present)\n\u2013 Execom, IEEE Web Resources (2022 - 2023)\n\n\u2022 Entrepreneurship Development Cell, RIT Bangalore,\n\n\u2013 IT Head (2024 - Present)\n\u2013 Content Writer and Social Media Manager (2023 - 2024)\n\nMajor Projects\n\u2022 ASTRA-SIM Research Project, HPE Industry Collaboration, Report\nFeb, 2024 - Oct, 2024\n\u2013 ASTRA SIM Research, optimizing 50+ configuration combinations for 100+ models, reducing overhead by 30%\n\n\u2022 Quantum Federated Learning Simulator, GitHub\nMar, 2025 - May, 2025\n\u2013 Achieved a comparative study and 90% efficiency and 50% improvement in precision in the use of a federated\nquantum learning environment to train ML models.\n\n\u2022 ML Based CAPTCHA: Redifining UIDAI website(SIH, 2024), GitHub\nAug 2024 - Oct 2024\n\u2013 Developed a 95 % accurate CAPTCHA based on user parameters fed into an ML model for GOI (ReactJS, Tensor-\nFlow, Selenium)\n\n\u2022 Rahasya: A Dark Pattern Detector Tool(DPBH, 2024), GitHub\nDec 2023 - Feb 2024\n\u2013 Developed an NLP and vision based Dark Patter detector for more than 20 Dark Patterns\n\n\u2022 Logistics Application for Small Businesses(Solve for India, 2023), GitHub\nJan 2023 - Jun 2023\n\u2013 Developed a blockchain based real time logistics management application using Flutter and Solidity\n\n1\n\nMinor Projects\nMonitoring systems and scaling, pipeline and incident management applications, mathematical concepts(Trasformers,\nNIST papers etc.)  implementation from scratch.  Quantitative finance concepts and uses.  Breaking down computer\nscience concepts(operating systems, technical frameworks and their uses). Frontend and Backend daily web applications.\nPortfolio for details.\n\u2022 Technical blogs\n\u2022 Non-technical blogs\nAchievements\n\u2022 Winner, Smart India Hackathon 2024 (Intra-college)\n\u2022 Winner, Smart India Hackathon 2023 (Intra-college)\n\u2022 Winner, Solving for India Hackathon 2023 (Inter-college)\n\u2022 Regional Round Winner, Dark Pattern Buster Hackathon 2024\n\u2022 Regional Round Winner, SAP Hackfest 2024\n\u2022 2nd runner-up, Leadership Unleashed, TAPMI 2025\n\u2022 Active contributor on LeetCode and CodeForces, solving complex algorithmic problems\n\n2\nMinor Projects\n\nMonitoring systems and scaling, pipeline and incident management applications, mathematical concepts(Trasformers,\nNIST papers etc.) implementation from scratch. Quantitative finance concepts and uses. Breaking down computer\nscience concepts(operating systems, technical frameworks and their uses). Frontend and Backend daily web applications.\nPortfolio for details.\n\u2022 Technical blogs\n\u2022 Non-technical blogs\nAchievements\n\n\u2022 Winner, Smart India Hackathon 2024 (Intra-college)\n\u2022 Winner, Smart India Hackathon 2023 (Intra-college)\n\u2022 Winner, Solving for India Hackathon 2023 (Inter-college)\n\u2022 Regional Round Winner, Dark Pattern Buster Hackathon 2024\n\u2022 Regional Round Winner, SAP Hackfest 2024\n\u2022 2nd runner-up, Leadership Unleashed, TAPMI 2025\n\u2022 Active contributor on LeetCode and CodeForces, solving complex algorithmic problems\n\n2",
    "file_path": "data/uploads/20250602_091342_DHANRAJ_RATERIA_BE_FINAL (2) - Dhanraj Rateria.pdf",
    "parsed_at": "2025-06-02T09:14:09.900203",
    "parser_type": "OCR+AI"
  },
  {
    "id": "20250602_100729",
    "filename": "20250602_100712_New_Resume (1) - SWAYAM RAO.pdf",
    "uploaded_at": "2025-06-01T06:00:37Z",
    "status": "parsed_and_stored",
    "uploaded_by": "pranamya-jain",
    "team": "Seeds! \ud83c\udf31",
    "name": "Swayam Rao",
    "email": "l138swayamrao14@gmail.com",
    "phone": "+91 9724174188",
    "location": "Bangalore, India",
    "skills": [
      "Python",
      "C",
      "C++",
      "Rust",
      "Nmap",
      "Wireshark",
      "Metasploit",
      "Burp Suite",
      "John the Ripper",
      "Hydra",
      "Linux (Kali, Ubuntu)",
      "Windows",
      "Penetration Testing",
      "Network Security",
      "Cryptography",
      "Vulnerability Assessment"
    ],
    "experience": [
      {
        "title": "Founding Member",
        "company": "secuRIT Club, MSRIT",
        "duration": "2024 \u2013 Present",
        "description": "Founded MSRIT\u2019s first cybersecurity club and led 15+ events including workshops, CTFs, and speaker sessions; engaged over 200+ students in cybersecurity activities."
      },
      {
        "title": "Student Coordinator and Developer",
        "company": "SAP Hackfest 2024",
        "duration": "2024",
        "description": "Developed and launched hackfest.info for SAP Hackfest 2024, managing logistics and communication for 200+ participants; achieved 98% post-event satisfaction."
      },
      {
        "title": "Student Coordinator",
        "company": "Emmetra Workshop",
        "duration": "2024",
        "description": "Coordinated cybersecurity workshop logistics and communications for 50+ attendees, including speaker outreach and technical setup."
      },
      {
        "title": "Founder",
        "company": "secuRIT Club",
        "duration": "2024 \u2013 Present",
        "description": "Spearheaded the launch of MSRIT\u2019s first cybersecurity club, bringing together over 200+ students to learn, compete, and collaborate."
      },
      {
        "title": "Student Coordinator",
        "company": "Hackfest.info",
        "duration": "2024",
        "description": "Acted as liaison between SAP mentors and student teams, ensuring smooth planning and execution of the hackathon."
      },
      {
        "title": "HackTheBox Team Member",
        "company": "MSRIT",
        "duration": "2024 \u2013 Present",
        "description": "Represented MSRIT in competitive CTFs, contributing to reverse engineering and web exploitation challenges."
      },
      {
        "title": "MSRIT Table Tennis Team",
        "company": "MSRIT",
        "duration": "2022 \u2013 Present",
        "description": "Competed in VTU inter-zonal tournaments, consistently ranked among top players."
      }
    ],
    "education": [
      {
        "degree": "B.E.",
        "institution": "M.S. Ramaiah Institute of Technology (MSRIT)",
        "year": "Expected Graduation: 2026",
        "field": "Computer Science and Engineering (Cyber Security)"
      },
      {
        "degree": "PU College",
        "institution": "Janasudha PU College",
        "year": "2022",
        "field": null
      }
    ],
    "experience_years": 2,
    "summary": "Passionate cybersecurity enthusiast currently in 6th semester of B.E. in Cyber Security with a CGPA of 8.74. Founding member of MSRIT\u2019s secuRIT club and active CTF competitor. Experienced in penetration testing, network security, and vulnerability assessment. CEH v12 Master Certified and ranked in the top 1% on TryHackMe.",
    "certifications": [
      "EC-Council Certified Ethical Hacker (CEH v12) \u2013 Master Certified",
      "TryHackMe (6 Learning Paths Completed): Jr. Penetration Tester, PenTest+, Buffer Overflow, Active Directory, Lateral Movement, Red Teaming.",
      "EC-Council: Ethical Hacking using NMAP",
      "Cisco: Ethical Hacker",
      "Udemy: Learn Ethical Hacking from Scratch (2024)"
    ],
    "languages": [
      "English",
      "Hindi",
      "Kannada"
    ],
    "projects": [
      {
        "name": "Network Analyzer",
        "description": "Designed a Python-based tool using Scapy to detect MITM attacks on LAN environments; tested across 3+ attack scenarios in lab simulations.",
        "technologies": [
          "Python",
          "Scapy"
        ]
      },
      {
        "name": "SecuRIT Club Website",
        "description": "Built and deployed the official website for MSRIT\u2019s cybersecurity club, providing a hub for 200+ students: securit.club.",
        "technologies": []
      },
      {
        "name": "SAP Hackathon Website",
        "description": "Managed end-to-end development of the hackfest.info platform used by 400+ students and mentors for SAP Hackfest registration, updates, and event tracking.",
        "technologies": []
      },
      {
        "name": "Web Fuzzer",
        "description": "Created a Python-based fuzzer to discover 10+ unique web vulnerabilities in practice labs; included HTML scraping and injection testing features.",
        "technologies": [
          "Python"
        ]
      },
      {
        "name": "Password Manager",
        "description": "Developed a secure offline password manager with AES-256 encryption in Python; verified encryption strength using 100+ password entries.",
        "technologies": [
          "Python",
          "AES-256"
        ]
      }
    ],
    "raw_text": "Swayam Rao\n  +91 9724174188 \u2014 l138swayamrao14@gmail.com \u2014 GitHub: SwayamRao \u2014 LinkedIn: Swayam Rao \u2014\n                                    TryHackMe: Grim1ock\n\nSummary\n\nPassionate cybersecurity enthusiast currently in 6th semester of B.E. in Cyber Security with a CGPA of 8.74.\nFounding member of MSRIT\u2019s secuRIT club and active CTF competitor. Experienced in penetration testing,\nnetwork security, and vulnerability assessment. CEH v12 Master Certified and ranked in the top 1% on\nTryHackMe.\n\nWork Experience\n\n\u2022 Founding Member \u2013 secuRIT Club                                              2024 \u2013 Present\n  Founded MSRIT\u2019s first cybersecurity club and led 15+ events including workshops, CTFs, and speaker sessions;\n  engaged over 200+ students in cybersecurity activities.\n\n\u2022 Student Coordinator and Developer \u2013 SAP Hackfest 2024                                2024\n  Developed and launched hackfest.info for SAP Hackfest 2024, managing logistics and communication for 200+\n  participants; achieved 98% post-event satisfaction.\n\n\u2022 Student Coordinator \u2013 Emmetra Workshop                                               2024\n  Coordinated cybersecurity workshop logistics and communications for 50+ attendees, including speaker out-\n  reach and technical setup.\n\nProjects\n\n\u2022 Network Analyzer                                                                        2024\n  Designed a Python-based tool using Scapy to detect MITM attacks on LAN environments; tested across 3+\n  attack scenarios in lab simulations.\n\n\u2022 SecuRIT Club Website                                                                   2024\n  Built and deployed the official website for MSRIT\u2019s cybersecurity club, providing a hub for 200+ students:\n  securit.club.\n\n\u2022 SAP Hackathon Website                                                                 2024\n  Managed end-to-end development of the hackfest.info platform used by 400+ students and mentors for SAP\n  Hackfest registration, updates, and event tracking.\n\n\u2022 Web Fuzzer                                                                              2023\n  Created a Python-based fuzzer to discover 10+ unique web vulnerabilities in practice labs; included HTML\n  scraping and injection testing features.\n\n\u2022 Password Manager                                                                       2023\n  Developed a secure offline password manager with AES-256 encryption in Python; verified encryption strength\n  using 100+ password entries.\n\n\u2022 More projects on: GitHub.\n\nAchievements\n\n\u2022 Ranked 5th, 7th, and 8th in EC-Council CEH Compete events (2024).\n\n\u2022 Top 1% on TryHackMe and 6 learning paths completed.\n\n\u2022 Solved 100+ CTF rooms across TryHackMe and picoCTF.\n\n\u2022 Published 30+ CTF writeups on GitHub with 500+ combined views and stars.\n\nLeadership and Extracurriculars\n\n1\nSwayam Rao\n+91 9724174188 \u2014 l138swayamrao14@gmail.com \u2014 GitHub: SwayamRao \u2014 LinkedIn: Swayam Rao \u2014\n\nTryHackMe: Grim1ock\n\nSummary\n\nPassionate cybersecurity enthusiast currently in 6th semester of B.E. in Cyber Security with a CGPA of 8.74.\nFounding member of MSRIT\u2019s secuRIT club and active CTF competitor. Experienced in penetration testing,\nnetwork security, and vulnerability assessment. CEH v12 Master Certified and ranked in the top 1% on\nTryHackMe.\n\nWork Experience\n\n\u2022 Founding Member \u2013 secuRIT Club\n2024 \u2013 Present\nFounded MSRIT\u2019s first cybersecurity club and led 15+ events including workshops, CTFs, and speaker sessions;\nengaged over 200+ students in cybersecurity activities.\n\n\u2022 Student Coordinator and Developer \u2013 SAP Hackfest 2024\n2024\nDeveloped and launched hackfest.info for SAP Hackfest 2024, managing logistics and communication for 200+\nparticipants; achieved 98% post-event satisfaction.\n\n\u2022 Student Coordinator \u2013 Emmetra Workshop\n2024\nCoordinated cybersecurity workshop logistics and communications for 50+ attendees, including speaker out-\nreach and technical setup.\n\nProjects\n\n\u2022 Network Analyzer\n2024\nDesigned a Python-based tool using Scapy to detect MITM attacks on LAN environments; tested across 3+\nattack scenarios in lab simulations.\n\n\u2022 SecuRIT Club Website\n2024\nBuilt and deployed the official website for MSRIT\u2019s cybersecurity club, providing a hub for 200+ students:\nsecurit.club.\n\n\u2022 SAP Hackathon Website\n2024\nManaged end-to-end development of the hackfest.info platform used by 400+ students and mentors for SAP\nHackfest registration, updates, and event tracking.\n\n\u2022 Web Fuzzer\n2023\nCreated a Python-based fuzzer to discover 10+ unique web vulnerabilities in practice labs; included HTML\nscraping and injection testing features.\n\n\u2022 Password Manager\n2023\nDeveloped a secure offline password manager with AES-256 encryption in Python; verified encryption strength\nusing 100+ password entries.\n\n\u2022 More projects on: GitHub.\n\nAchievements\n\n\u2022 Ranked 5th, 7th, and 8th in EC-Council CEH Compete events (2024).\n\n\u2022 Top 1% on TryHackMe and 6 learning paths completed.\n\n\u2022 Solved 100+ CTF rooms across TryHackMe and picoCTF.\n\n\u2022 Published 30+ CTF writeups on GitHub with 500+ combined views and stars.\n\nLeadership and Extracurriculars\n\n1\n\n\u2022 Founder \u2013 secuRIT Club                                                        2024 \u2013 Present\n  Spearheaded the launch of MSRIT\u2019s first cybersecurity club, bringing together over 200+ students to learn,\n  compete, and collaborate.\n\n\u2022 Student Coordinator \u2013 Hackfest.info                                                      2024\n  Acted as liaison between SAP mentors and student teams, ensuring smooth planning and execution of the\n  hackathon.\n\n\u2022 HackTheBox Team Member                                                     2024 \u2013 Present\n  Represented MSRIT in competitive CTFs, contributing to reverse engineering and web exploitation challenges.\n\n\u2022 MSRIT Table Tennis Team                                                      2022 \u2013 Present\n  Competed in VTU inter-zonal tournaments, consistently ranked among top players.\n\nEducation\n\nM.S. Ramaiah Institute of Technology (MSRIT), Bangalore               Expected Graduation: 2026\n\n\u2022 B.E. in Computer Science and Engineering (Cyber Security)\n\n\u2022 Current CGPA: 8.74 (6th Semester)\n\nJanasudha PU College                                                               Graduated: 2022\n\n\u2022 Secured 95%\n\nCertifications\n\n\u2022 EC-Council Certified Ethical Hacker (CEH v12) \u2013 Master Certified\n  Completed both theoretical and practical assessments; top 10 placement in CEH Compete (5th, 7th, 8th ranks).\n\n\u2022 TryHackMe (6 Learning Paths Completed)\n   Jr. Penetration Tester, PenTest+, Buffer Overflow, Active Directory, Lateral Movement, Red Teaming.\n\n\u2022 EC-Council: Ethical Hacking using NMAP\n\n\u2022 Cisco: Ethical Hacker\n\n\u2022 Udemy: Learn Ethical Hacking from Scratch (2024)\n\nTechnical Skills\n\n\u2022 Languages: Python, C, C++, Rust\n\n\u2022 Tools: Nmap, Wireshark, Metasploit, Burp Suite, John the Ripper, Hydra\n\n\u2022 OS: Linux (Kali, Ubuntu), Windows\n\n\u2022 Domains: Penetration Testing, Network Security, Cryptography, Vulnerability Assessment\n\nAdditional Information\n\n\u2022 Languages Known: English (Fluent), Hindi (Fluent), Kannada (Native)\n\n\u2022 Hobbies: Cybersecurity, Table Tennis, Chess, Ethical Hacking\n\n2\n\u2022 Founder \u2013 secuRIT Club\n2024 \u2013 Present\nSpearheaded the launch of MSRIT\u2019s first cybersecurity club, bringing together over 200+ students to learn,\ncompete, and collaborate.\n\n\u2022 Student Coordinator \u2013 Hackfest.info\n2024\nActed as liaison between SAP mentors and student teams, ensuring smooth planning and execution of the\nhackathon.\n\n\u2022 HackTheBox Team Member\n2024 \u2013 Present\nRepresented MSRIT in competitive CTFs, contributing to reverse engineering and web exploitation challenges.\n\n\u2022 MSRIT Table Tennis Team\n2022 \u2013 Present\nCompeted in VTU inter-zonal tournaments, consistently ranked among top players.\n\nEducation\n\nM.S. Ramaiah Institute of Technology (MSRIT), Bangalore\nExpected Graduation: 2026\n\n\u2022 B.E. in Computer Science and Engineering (Cyber Security)\n\n\u2022 Current CGPA: 8.74 (6th Semester)\n\nJanasudha PU College\nGraduated: 2022\n\n\u2022 Secured 95%\n\nCertifications\n\n\u2022 EC-Council Certified Ethical Hacker (CEH v12) \u2013 Master Certified\nCompleted both theoretical and practical assessments; top 10 placement in CEH Compete (5th, 7th, 8th ranks).\n\n\u2022 TryHackMe (6 Learning Paths Completed)\nJr. Penetration Tester, PenTest+, Buffer Overflow, Active Directory, Lateral Movement, Red Teaming.\n\n\u2022 EC-Council: Ethical Hacking using NMAP\n\n\u2022 Cisco: Ethical Hacker\n\n\u2022 Udemy: Learn Ethical Hacking from Scratch (2024)\n\nTechnical Skills\n\n\u2022 Languages: Python, C, C++, Rust\n\n\u2022 Tools: Nmap, Wireshark, Metasploit, Burp Suite, John the Ripper, Hydra\n\n\u2022 OS: Linux (Kali, Ubuntu), Windows\n\n\u2022 Domains: Penetration Testing, Network Security, Cryptography, Vulnerability Assessment\n\nAdditional Information\n\n\u2022 Languages Known: English (Fluent), Hindi (Fluent), Kannada (Native)\n\n\u2022 Hobbies: Cybersecurity, Table Tennis, Chess, Ethical Hacking\n\n2",
    "file_path": "data/uploads/20250602_100712_New_Resume (1) - SWAYAM RAO.pdf",
    "parsed_at": "2025-06-02T10:07:29.243766",
    "parser_type": "OCR+AI"
  },
  {
    "id": "20250605_113812",
    "filename": "20250605_113806_Chirantana_resume (1) - Chirantana P.pdf",
    "uploaded_at": "2025-06-01T06:00:37Z",
    "status": "parsed_and_stored",
    "uploaded_by": "pranamya-jain",
    "team": "Seeds! \ud83c\udf31",
    "name": "Chirantana P",
    "email": "chirantanofficial28@gmail.com",
    "phone": "+91 8105832218",
    "location": "Bangalore, India",
    "skills": [
      "Python",
      "Java",
      "C",
      "Dart",
      "C++",
      "HTML",
      "CSS",
      "JAVASCRIPT",
      "MySQL Database Management",
      "MongoDB",
      "Data Structures and Algorithms",
      "Mobile application development using Flutter",
      "Angular Web Developer Certification",
      "Advance Java Programming (Servelet,JDBC,JSP)",
      "Operating Systems",
      "Digital Design and Computer Architecture",
      "MicroControllers and Internet of Things",
      "Airtificial Intelligence and Machine Learning",
      "Deep Learning",
      "Digital Communications and Networking",
      "Cryptography and Network Security",
      "Dockers and Containers"
    ],
    "experience": [],
    "education": [
      {
        "degree": "Bachelor of Engineering",
        "institution": "Ramaiah Institute of Technology",
        "year": "Dec 2022 \u2013 Aug 2026 (expected)",
        "field": "Computer Science and Engineering"
      },
      {
        "degree": "AISSE",
        "institution": "KLE Society\u2019s School,Bangalore",
        "year": "Jun 2007 \u2013 March 2020",
        "field": null
      },
      {
        "degree": "2nd PU Board Examination",
        "institution": "Oxford Independent PU College,Bangalore",
        "year": "March 2020 \u2013 March 2022",
        "field": null
      }
    ],
    "experience_years": 0,
    "summary": "3rd year Computer Science Engineering student at Ramaiah Institute of Technology,looking forward to leverage programming skills, strong communication, and effective team management abilities. Enthusiastically looking forward to contributing to innovative projects, learning from industry experts, and embracing challenges with a genuine interest in continuous learning and unwavering dedication to personal and professional development.",
    "certifications": [
      "Angular Web Developer Certification"
    ],
    "languages": [],
    "projects": [
      {
        "name": "RoadPatch",
        "description": "Incorporation of YOLOv5 models for depth and risk analysis of potholes. Scalable application supported by MySQL for secure and efficient data management. Integrated Google Maps API for real time detection of pothole\u2019s location",
        "technologies": [
          "YOLOv5",
          "MySQL",
          "Google Maps API"
        ]
      },
      {
        "name": "Studvery(Whackiest Hackathon 2024)",
        "description": "Developed a Flutter based on campus quick commerce platform enabling students to seamlessly switch between Orderer and Deliverer modes for service exchange. Integrated Firebase authentication, dark/light theme toggle, and real-time order management. Designed a modern brand identity, including a custom logo and tagline to enhance user engagement.",
        "technologies": [
          "Flutter",
          "Firebase"
        ]
      },
      {
        "name": "LiveFace (Smart India Hackathon 2024)",
        "description": "Edge computing models (4MB size, 350ms response time) for secure authentication. Multiphase testing and edge cases to improve system efficiency.",
        "technologies": []
      },
      {
        "name": "Car-Go",
        "description": "Built a Flutter based platform for facilitating carpooling among users with similar travel routes. Aimed at reducing environmental impact and providing cost-effective travel options. Integrated Firebase authentication",
        "technologies": [
          "Flutter",
          "Firebase"
        ]
      }
    ],
    "raw_text": "Chirantana P\n                \u0083 +91 8105832218 # chirantanofficial28@gmail.com\n                    \u00ef linkedin.com/in/chirantana-p-18388a236/\n\nCareer Objective\n\n3rd year Computer Science Engineering student at Ramaiah Institute of Technology,looking forward to leverage\nprogramming skills, strong communication, and effective team management abilities. Enthusiastically looking\nforward to contributing to innovative projects, learning from industry experts, and embracing challenges with a\ngenuine interest in continuous learning and unwavering dedication to personal and professional development.\n\nEducation\n\nRamaiah Institute of Technology                                 Dec 2022 \u2013 Aug 2026 (expected)\nBachelor of Engineering, Computer Science and Engineering                         CGPA: 9.56 (Semesters I-IV)\n\nKLE Society\u2019s School,Bangalore                                          Jun 2007 \u2013 March 2020\nAISSE: 92%\n\nOxford Independent PU College,Bangalore                             March 2020 \u2013 March 2022\n2nd PU Board Examination:95%\n\nSkills\n\nProgramming\n\n     \u2022 Python, Java, C, Dart, C++\n\n     \u2022 HTML,CSS,JAVASCRIPT\n\n     \u2022 MySQL Database Management\n\n     \u2022 MongoDB\n\n     \u2022 Data Structures and Algorithms\n\n     \u2022 Mobile application development using Flutter\n\n     \u2022 Completed Angular Web Developer Certification\n\n     \u2022 Advance Java Programming(Servelet,JDBC,JSP)\n\nOther Technical Skills\n\n     \u2022 Operating Systems, Digital Design and Computer Architecture\n\n     \u2022 MicroControllers and Internet of Things\n\n     \u2022 Airtificial Intelligence and Machine Learning,Deep Learning\n\n     \u2022 Digital Communications and Networking,Cryptography and Network Security\n\n     \u2022 Dockers and Containers\n\nProjects\n\nRoadPatch                                                                              Jan 2025\n    \u2022 Incorporation of YOLOv5 models for depth and risk analysis of potholes.\n    \u2022 Scalable application supported by MySQL for secure and efficient data management.\n    \u2022 Integrated Google Maps API for real time detection of pothole\u2019s location\n\nStudvery(Whackiest Hackathon 2024)                                                      Dec 2024\n    \u2022 Developed a Flutter based on campus quick commerce platform enabling students to seamlessly switch between Orderer\n    and Deliverer modes for service exchange.\n    \u2022 Integrated Firebase authentication, dark/light theme toggle, and real-time order management.\n    \u2022 Designed a modern brand identity, including a custom logo and tagline to enhance user engagement.\nChirantana P\n\u0083 +91 8105832218\n# chirantanofficial28@gmail.com\n\u00ef linkedin.com/in/chirantana-p-18388a236/\n\nCareer Objective\n\n3rd year Computer Science Engineering student at Ramaiah Institute of Technology,looking forward to leverage\nprogramming skills, strong communication, and effective team management abilities. Enthusiastically looking\nforward to contributing to innovative projects, learning from industry experts, and embracing challenges with a\ngenuine interest in continuous learning and unwavering dedication to personal and professional development.\n\nEducation\n\nRamaiah Institute of Technology\nDec 2022 \u2013 Aug 2026 (expected)\nBachelor of Engineering, Computer Science and Engineering\nCGPA: 9.56 (Semesters I-IV)\n\nKLE Society\u2019s School,Bangalore\nJun 2007 \u2013 March 2020\nAISSE: 92%\n\nOxford Independent PU College,Bangalore\nMarch 2020 \u2013 March 2022\n2nd PU Board Examination:95%\n\nSkills\n\nProgramming\n\n\u2022 Python, Java, C, Dart, C++\n\n\u2022 HTML,CSS,JAVASCRIPT\n\n\u2022 MySQL Database Management\n\n\u2022 MongoDB\n\n\u2022 Data Structures and Algorithms\n\n\u2022 Mobile application development using Flutter\n\n\u2022 Completed Angular Web Developer Certification\n\n\u2022 Advance Java Programming(Servelet,JDBC,JSP)\n\nOther Technical Skills\n\n\u2022 Operating Systems, Digital Design and Computer Architecture\n\n\u2022 MicroControllers and Internet of Things\n\n\u2022 Airtificial Intelligence and Machine Learning,Deep Learning\n\n\u2022 Digital Communications and Networking,Cryptography and Network Security\n\n\u2022 Dockers and Containers\n\nProjects\n\nRoadPatch\nJan 2025\n\n\u2022 Incorporation of YOLOv5 models for depth and risk analysis of potholes.\n\n\u2022 Scalable application supported by MySQL for secure and efficient data management.\n\n\u2022 Integrated Google Maps API for real time detection of pothole\u2019s location\n\nStudvery(Whackiest Hackathon 2024)\nDec 2024\n\n\u2022 Developed a Flutter based on campus quick commerce platform enabling students to seamlessly switch between Orderer\nand Deliverer modes for service exchange.\n\n\u2022 Integrated Firebase authentication, dark/light theme toggle, and real-time order management.\n\n\u2022 Designed a modern brand identity, including a custom logo and tagline to enhance user engagement.\n\nLiveFace (Smart India Hackathon 2024)                                                Aug 2024\n    \u2022 Edge computing models (4MB size, 350ms response time) for secure authentication.\n    \u2022 Multiphase testing and edge cases to improve system efficiency.\n\nCar-Go                                                                      Nov 2023\n    \u2022 Built a Flutter based platform for facilitating carpooling among users with similar travel routes. Aimed at reducing\n     environmental impact and providing cost-effective travel options.\n    \u2022 Integrated Firebase authentication\nLiveFace (Smart India Hackathon 2024)\nAug 2024\n\n\u2022 Edge computing models (4MB size, 350ms response time) for secure authentication.\n\n\u2022 Multiphase testing and edge cases to improve system efficiency.\n\nCar-Go\nNov 2023\n\n\u2022 Built a Flutter based platform for facilitating carpooling among users with similar travel routes. Aimed at reducing\nenvironmental impact and providing cost-effective travel options.\n\n\u2022 Integrated Firebase authentication",
    "file_path": "data/uploads/20250605_113806_Chirantana_resume (1) - Chirantana P.pdf",
    "parsed_at": "2025-06-05T11:38:12.326355",
    "parser_type": "OCR+AI"
  },
  {
    "id": "20250605_113841",
    "filename": "20250605_113836_RESUME_NEW - DIVYASHREE G P.pdf",
    "uploaded_at": "2025-06-01T06:00:37Z",
    "status": "parsed_and_stored",
    "uploaded_by": "pranamya-jain",
    "team": "Seeds! \ud83c\udf31",
    "name": "Divyashree G P",
    "email": "divyashreegp14@gmail.com",
    "phone": "+919071554858",
    "location": null,
    "skills": [
      "C",
      "C++",
      "Java",
      "R",
      "Python",
      "JavaScript",
      "HTML",
      "CSS",
      "SQL",
      "Bash/Shell scripting",
      "SolidEdge",
      "Hadoop",
      "Apache Spark",
      "Apache Hive",
      "Apache Tomcat",
      "Figma",
      "PowerBI",
      "XAMPP",
      "Data Structures & Algorithms (DSA)",
      "Windows",
      "Linux"
    ],
    "experience": [],
    "education": [
      {
        "degree": "Pre-University Course (Science)",
        "institution": "Masters PU college",
        "year": "2020-2022",
        "field": "PCMB"
      },
      {
        "degree": "BACHELOR OF ENGINEERING",
        "institution": "RAMAIAH INSTITUTE OF TECHNOLOGY",
        "year": "2022-2026",
        "field": "CSE(Cyber Security)"
      }
    ],
    "experience_years": null,
    "summary": "Highly motivated and detail-oriented engineering student specializing in Computer Science with a focus on Cybersecurity and Data Analytics. Proficient in programming languages such as C, C++, Java, and Python, with hands-on experience in web development, security practices, and data analysis tools like Power BI and Hadoop. Strong problem-solving and analytical abilities, committed to continuous learning and growth. Eager to apply theoretical knowledge to real-world challenges and contribute to secure, data-driven solutions in the field of technology.",
    "certifications": [
      "Finding the Leader in You - Scholar program",
      "The Competitiveness Mindset Institute, USA",
      "Data Structures and Algorithms UDEMY",
      "Introduction to Generative AI for Software Development DeepLearning.AI"
    ],
    "languages": [
      "Kannada",
      "English",
      "Hindi"
    ],
    "projects": [
      {
        "name": "Uber Data Analysis using Hadoop",
        "description": "Analyzed large Uber datasets to derive insights into ride patterns, driver performance, and geographical demand using Hadoop.",
        "technologies": [
          "Hadoop",
          "MapReduce",
          "Java",
          "Data Analysis"
        ]
      },
      {
        "name": "Natural Language to Python Code Translator",
        "description": "Developed a translator that converts pseudo-code written in natural language into executable Python code using Syntax Directed Translation (SDT).",
        "technologies": [
          "Python",
          "Syntax Directed Translation (SDT)"
        ]
      },
      {
        "name": "Text Summarization Web Application",
        "description": "Developed a web app using Flask and the T5 model for text summarization, with a user-friendly interface built with HTML, CSS, and JavaScript.",
        "technologies": [
          "Flask",
          "T5 model",
          "HTML",
          "CSS",
          "JavaScript"
        ]
      },
      {
        "name": "Electric Vehicle-based Ride-sharing App for College Girls",
        "description": "Developed a secure, environmentally-friendly ride-sharing app focused on safety and privacy for college-going girls. Integrated features like encrypted user data and secure ride tracking.",
        "technologies": [
          "React Native",
          "JavaScript",
          "Firebase",
          "Google Maps API",
          "Security Best Practices"
        ]
      }
    ],
    "raw_text": "DIVYASHREE G P\n                                CSE[CYBER SECURITY] STUDENT\n\n                            \ue3b8+919071554858 \ue0acdivyashreegp14@gmail.com\n\n           Education           Summary\n\n       Masters PU college            Highly motivated and detail-oriented engineering student specializing in\n          PCMB                Computer Science with a focus on Cybersecurity and Data Analytics.\n               97.8                     Proficient in programming languages such as C, C++, Java, and Python,\n   Pre-University Course (Science)      with hands-on experience in web development, security practices, and\n           2020-2022                data analysis tools like Power BI and Hadoop. Strong problem-solving and\n                                          analytical abilities, committed to continuous learning and growth. Eager\n    RAMAIAH INSTITUTE OF\n                                          to apply theoretical knowledge to real-world challenges and contribute to\n       TECHNOLOGY\n                                        secure, data-driven solutions in the field of technology.\n       CSE(Cyber Security)\n               9.25\n                                         Skills\n  BACHELOR OF ENGINEERING\n           2022-2026             Programming Languages:\n                                                   C, C++, Java, R, Python, JavaScript, HTML, CSS, SQL, Bash/Shell scripting\n           Certifications\n                                     Platforms/Technologies:\nFinding the Leader in You - Scholar\n                                             SolidEdge, Hadoop, Apache Spark, Apache Hive, Apache Tomcat, Figma, PowerBI,           program\n                                XAMPP\n   The Competitiveness Mindset\n             Institute, USA              Data Structures & Algorithms (DSA)\n\ue2e2FLY                             Data Processing:\n\n  Data Structures and Algorithms      Hadoop, Spark, Hive\n          UDEMY                                   Data Base Management System\n\ue2e2DSA\n                                    Operating Systems\n Introduction to Generative AI for                                       Windows, Linux\n      Software Development\n         DeepLearning.AI           Projects\n\ue2e2GenAI                         Uber Data Analysis using Hadoop\n                                    Analyzed large Uber datasets to derive insights into ride patterns, driver\n         Achievements              performance, and geographical demand using Hadoop.\n       Amazon Scholar              Hadoop, MapReduce, Java, Data Analysis\n Awarded for exceptional academic\n                                     Natural Language to Python Code Translator\n  performance in 2nd PUC through\n                                   Developed a translator that converts pseudo-code written in natural\n         the FFE program.\n                                    language into executable Python code using Syntax Directed Translation\n         Katalyst Trainee              (SDT).\n  Selected as a trainee for Katalyst,                                           Python, Syntax Directed Translation (SDT)\n   gaining exposure to leadership\n                                    Text Summarization Web Application  development and team-building\n                                   Developed a web app using Flask and the T5 model for text                   skills.\n                                    summarization, with a user-friendly interface built with HTML, CSS, and\n           Languages                 JavaScript.\n          Kannada                  Electric Vehicle-based Ride-sharing App for College Girls\n                                   Developed a secure, environmentally-friendly ride-sharing app focused             English\n                                on safety and privacy for college-going girls. Integrated features like\n             Hindi                  encrypted user data and secure ride tracking.\n\n                                          React Native, JavaScript, Firebase, Google Maps API, Security Best Practices\nDIVYASHREE G P\nCSE[CYBER SECURITY] STUDENT\n\n\ue3b8+919071554858\n\ue0acdivyashreegp14@gmail.com\n\nEducation\n\nSummary\n\nMasters PU college\n\nHighly motivated and detail-oriented engineering student specializing in\nComputer Science with a focus on Cybersecurity and Data Analytics.\nProficient in programming languages such as C, C++, Java, and Python,\nwith hands-on experience in web development, security practices, and\ndata analysis tools like Power BI and Hadoop. Strong problem-solving and\nanalytical abilities, committed to continuous learning and growth. Eager\nto apply theoretical knowledge to real-world challenges and contribute to\nsecure, data-driven solutions in the field of technology.\n\nPCMB\n\n97.8\nPre-University Course (Science)\n\n2020-2022\n\nRAMAIAH INSTITUTE OF\n\nTECHNOLOGY\nCSE(Cyber Security)\n\n9.25\nBACHELOR OF ENGINEERING\n\nSkills\n\nProgramming Languages:\n\n2022-2026\n\nC, C++, Java, R, Python, JavaScript, HTML, CSS, SQL, Bash/Shell scripting\n\nCertifications\n\nPlatforms/Technologies:\n\nFinding the Leader in You - Scholar\n\nSolidEdge, Hadoop, Apache Spark, Apache Hive, Apache Tomcat, Figma, PowerBI,\nXAMPP\n\nprogram\nThe Competitiveness Mindset\n\nInstitute, USA\n\nData Structures & Algorithms (DSA)\n\n\ue2e2FLY\n\nData Processing:\n\nHadoop, Spark, Hive\n\nData Structures and Algorithms\n\nUDEMY\n\nData Base Management System\n\n\ue2e2DSA\n\nOperating Systems\n\nIntroduction to Generative AI for\n\nWindows, Linux\n\nSoftware Development\n\nProjects\n\nDeepLearning.AI\n\nUber Data Analysis using Hadoop\nAnalyzed large Uber datasets to derive insights into ride patterns, driver\nperformance, and geographical demand using Hadoop.\n\n\ue2e2GenAI\n\nAchievements\n\nAmazon Scholar\nAwarded for exceptional academic\n\nHadoop, MapReduce, Java, Data Analysis\n\nNatural Language to Python Code Translator\nDeveloped a translator that converts pseudo-code written in natural\nlanguage into executable Python code using Syntax Directed Translation\n(SDT).\n\nperformance in 2nd PUC through\n\nthe FFE program.\n\nKatalyst Trainee\nSelected as a trainee for Katalyst,\n\nPython, Syntax Directed Translation (SDT)\n\ngaining exposure to leadership\ndevelopment and team-building\n\nText Summarization Web Application\nDeveloped a web app using Flask and the T5 model for text\nsummarization, with a user-friendly interface built with HTML, CSS, and\nJavaScript.\n\nskills.\n\nLanguages\n\nKannada\n\nElectric Vehicle-based Ride-sharing App for College Girls\nDeveloped a secure, environmentally-friendly ride-sharing app focused\non safety and privacy for college-going girls. Integrated features like\nencrypted user data and secure ride tracking.\n\nEnglish\n\nHindi\n\nReact Native, JavaScript, Firebase, Google Maps API, Security Best Practices",
    "file_path": "data/uploads/20250605_113836_RESUME_NEW - DIVYASHREE G P.pdf",
    "parsed_at": "2025-06-05T11:38:41.485004",
    "parser_type": "OCR+AI"
  },
  {
    "id": "20250605_122621",
    "filename": "20250605_121624_DHANRAJ_RATERIA_BE_FINAL (2) - Dhanraj Rateria.pdf",
    "uploaded_at": "2025-06-01T06:00:37Z",
    "status": "parsed_and_stored",
    "uploaded_by": "pranamya-jain",
    "team": "Seeds! \ud83c\udf31",
    "name": "Dhanraj Rateria",
    "email": "dhanrajrateria@gmail.com",
    "phone": "+91 8234012941",
    "location": "  Flutter, HT",
    "skills": [
      "Tensorflow",
      "Go",
      "Leadership",
      "Pytorch",
      "Python",
      "Devops",
      "Windows",
      "Gcp",
      "R",
      "Java",
      "React",
      "Seaborn",
      "Sql",
      "Git",
      "Docker",
      "Html",
      "Design",
      "Mysql",
      "Jenkins",
      "Flask",
      "Numpy",
      "Css",
      "Pandas",
      "Linux",
      "Bash",
      "Aws",
      "Deep Learning",
      "Azure",
      "Scikit-Learn",
      "Github"
    ],
    "experience": [
      {
        "title": "Content Writer and Social Media Manager",
        "company": "Major Projects",
        "duration": "Not specified",
        "description": "Details extracted from resume"
      }
    ],
    "education": [
      {
        "degree": "ma",
        "institution": "Institute",
        "year": "Not specified",
        "field": "Not specified"
      },
      {
        "degree": "ma",
        "institution": "Institute",
        "year": "Not specified",
        "field": "Not specified"
      }
    ],
    "experience_years": 0,
    "summary": "R dhanrajrateria@gmail.com | R 1ms22cy020@msrit.edu | \u00d3 +91 8234012941 | \u00bd Bengaluru, India\n    \u0087 GitHub | \u00af LinkedIn | / LeetCode | \uf1c0Kaggle | / CodeForces | 7 Twitter | 2 Hugging Face | \u008c Portfolio",
    "certifications": [],
    "languages": [],
    "projects": [],
    "raw_text": "Dhanraj Rateria\n\n      R dhanrajrateria@gmail.com | R 1ms22cy020@msrit.edu | \u00d3 +91 8234012941 | \u00bd Bengaluru, India\n    \u0087 GitHub | \u00af LinkedIn | / LeetCode | \uf1c0Kaggle | / CodeForces | 7 Twitter | 2 Hugging Face | \u008c Portfolio\n\nEducation\n\u2022 BE, Computer Science & Engineering (Cyber Security), Ramaiah Institute Of Technology, Bengaluru   2026\n CGPA or CPI: 9.3/10.0\n\u2022 Senior Secondary (XII), Science, O.P. Jindal School Patrapali, Raigarh                                2022\n  Percentage: 96.00% (CBSE board)\n\u2022 Secondary (X), O.P. Jindal School Patrapali, Raigarh                                                  2020\n  Percentage: 98.00% (CBSE board)\n\nTechnical Skills                     Relevant Coursework\nProgramming: Python, C, Java, Bash Operating Sys-  Engineering Mathematics, Operating Systems, Data Struc-\ntems: Windows, Linux ML & Data Processing: Ten-  tures and Algorithms, Database Management Systems,\nsorFlow, PyTorch, Scikit-learn, Numpy, Pandas, Seaborn  Computer Networks, Computer  Architecture,  Compiler\nWeb & Mobile:  Flutter, HTML, CSS, ReactJS, Nex-  Design,  Automata  Theory,  UNIX, AWS  Fundamen-\ntJS Backend & DevOps:  Flask, NodeJS, Docker, Ku-  tals,Software Engineering, Natural Language Processing,\nbernetes, Git,CI/CD(Jenkins), Prometheus, Hadoop, Spark  Deep Learning, TensorFlow Development, Machine Learn-\nCloud: GCP, AWS (EKS, ECS), Azure Database: Mon-  ing, Cryptography\ngoDB, MySQL, Firebase Quantum Computing: Qiskit,\nQuantum Algorithms, Quantum Circuits\n\nProfessional Experience\n\u2022 Hewlett Packard Enterprise (HPE)\n  \u2013 CPP Research Project Intern, Feb, 2025 - Present\n    \u2217Working on developing AI-powered Quantum Resistant Cryptographic Algorithms\n   \u2217Aiming to achieve 90% efficiency compared to traditional algorithms\n\n  \u2013 Research Project Intern, Feb, 2024 - Oct, 2024\n   \u2217ASTRA SIM Research, optimizing 50+ configuration combinations for 100+ models, reducing overhead by 30%\n    \u2217Analyzed performance metrics to enhance distributed training, boosting model convergence speed by 15%\n\n\u2022 Unisys\n  \u2013 Research Project Intern, Nov, 2024 - Present\n    \u2217Developed an Intelligent Assistant simplifying the process of generating and modifying product configurations\n   \u2217Worked with XML files with over 3000 configurations and attributes, optimizing generation and matching\n\nLeadership & Volunteer Experience\n\u2022 IEEE RIT, Bangalore,\n  \u2013 Treasurer, IEEE Computer Society (2023 - Present)\n  \u2013 Execom, IEEE Web Resources (2022 - 2023)\n\n\u2022 Entrepreneurship Development Cell, RIT Bangalore,\n  \u2013 IT Head (2024 - Present)\n  \u2013 Content Writer and Social Media Manager (2023 - 2024)\n\nMajor Projects\n\u2022 ASTRA-SIM Research Project, HPE Industry Collaboration, Report                      Feb, 2024 - Oct, 2024\n  \u2013 ASTRA SIM Research, optimizing 50+ configuration combinations for 100+ models, reducing overhead by 30%\n\n\u2022 Quantum Federated Learning Simulator, GitHub                                  Mar, 2025 - May, 2025\n  \u2013 Achieved a comparative study and 90% efficiency and 50% improvement in precision in the use of a federated\n    quantum learning environment to train ML models.\n\n\u2022 ML Based CAPTCHA: Redifining UIDAI website(SIH, 2024), GitHub             Aug 2024 - Oct 2024\n  \u2013 Developed a 95 % accurate CAPTCHA based on user parameters fed into an ML model for GOI (ReactJS, Tensor-\n    Flow, Selenium)\n\n\u2022 Rahasya: A Dark Pattern Detector Tool(DPBH, 2024), GitHub                    Dec 2023 - Feb 2024\n  \u2013 Developed an NLP and vision based Dark Patter detector for more than 20 Dark Patterns\n\n\u2022 Logistics Application for Small Businesses(Solve for India, 2023), GitHub            Jan 2023 - Jun 2023\n  \u2013 Developed a blockchain based real time logistics management application using Flutter and Solidity\n\n1\nDhanraj Rateria\n\nR dhanrajrateria@gmail.com | R 1ms22cy020@msrit.edu | \u00d3 +91 8234012941 | \u00bd Bengaluru, India\n\u0087 GitHub | \u00af LinkedIn | / LeetCode | \uf1c0Kaggle | / CodeForces | 7 Twitter | 2 Hugging Face | \u008c Portfolio\n\nEducation\n\n\u2022 BE, Computer Science & Engineering (Cyber Security), Ramaiah Institute Of Technology, Bengaluru\n2026\nCGPA or CPI: 9.3/10.0\n\u2022 Senior Secondary (XII), Science, O.P. Jindal School Patrapali, Raigarh\n2022\nPercentage: 96.00% (CBSE board)\n\u2022 Secondary (X), O.P. Jindal School Patrapali, Raigarh\n2020\nPercentage: 98.00% (CBSE board)\n\nTechnical Skills\nProgramming: Python, C, Java, Bash Operating Sys-\ntems: Windows, Linux ML & Data Processing: Ten-\nsorFlow, PyTorch, Scikit-learn, Numpy, Pandas, Seaborn\nWeb & Mobile:\nFlutter, HTML, CSS, ReactJS, Nex-\ntJS Backend & DevOps: Flask, NodeJS, Docker, Ku-\nbernetes, Git,CI/CD(Jenkins), Prometheus, Hadoop, Spark\nCloud: GCP, AWS (EKS, ECS), Azure Database: Mon-\ngoDB, MySQL, Firebase Quantum Computing: Qiskit,\nQuantum Algorithms, Quantum Circuits\n\nRelevant Coursework\nEngineering Mathematics, Operating Systems, Data Struc-\ntures and Algorithms, Database Management Systems,\nComputer Networks, Computer Architecture, Compiler\nDesign,\nAutomata\nTheory,\nUNIX,\nAWS\nFundamen-\ntals,Software Engineering, Natural Language Processing,\nDeep Learning, TensorFlow Development, Machine Learn-\ning, Cryptography\n\nProfessional Experience\n\n\u2022 Hewlett Packard Enterprise (HPE)\n\n\u2013 CPP Research Project Intern, Feb, 2025 - Present\n\n\u2217Working on developing AI-powered Quantum Resistant Cryptographic Algorithms\n\u2217Aiming to achieve 90% efficiency compared to traditional algorithms\n\n\u2013 Research Project Intern, Feb, 2024 - Oct, 2024\n\n\u2217ASTRA SIM Research, optimizing 50+ configuration combinations for 100+ models, reducing overhead by 30%\n\u2217Analyzed performance metrics to enhance distributed training, boosting model convergence speed by 15%\n\n\u2022 Unisys\n\n\u2013 Research Project Intern, Nov, 2024 - Present\n\n\u2217Developed an Intelligent Assistant simplifying the process of generating and modifying product configurations\n\u2217Worked with XML files with over 3000 configurations and attributes, optimizing generation and matching\n\nLeadership & Volunteer Experience\n\u2022 IEEE RIT, Bangalore,\n\n\u2013 Treasurer, IEEE Computer Society (2023 - Present)\n\u2013 Execom, IEEE Web Resources (2022 - 2023)\n\n\u2022 Entrepreneurship Development Cell, RIT Bangalore,\n\n\u2013 IT Head (2024 - Present)\n\u2013 Content Writer and Social Media Manager (2023 - 2024)\n\nMajor Projects\n\u2022 ASTRA-SIM Research Project, HPE Industry Collaboration, Report\nFeb, 2024 - Oct, 2024\n\u2013 ASTRA SIM Research, optimizing 50+ configuration combinations for 100+ models, reducing overhead by 30%\n\n\u2022 Quantum Federated Learning Simulator, GitHub\nMar, 2025 - May, 2025\n\u2013 Achieved a comparative study and 90% efficiency and 50% improvement in precision in the use of a federated\nquantum learning environment to train ML models.\n\n\u2022 ML Based CAPTCHA: Redifining UIDAI website(SIH, 2024), GitHub\nAug 2024 - Oct 2024\n\u2013 Developed a 95 % accurate CAPTCHA based on user parameters fed into an ML model for GOI (ReactJS, Tensor-\nFlow, Selenium)\n\n\u2022 Rahasya: A Dark Pattern Detector Tool(DPBH, 2024), GitHub\nDec 2023 - Feb 2024\n\u2013 Developed an NLP and vision based Dark Patter detector for more than 20 Dark Patterns\n\n\u2022 Logistics Application for Small Businesses(Solve for India, 2023), GitHub\nJan 2023 - Jun 2023\n\u2013 Developed a blockchain based real time logistics management application using Flutter and Solidity\n\n1\n\nMinor Projects\nMonitoring systems and scaling, pipeline and incident management applications, mathematical concepts(Trasformers,\nNIST papers etc.)  implementation from scratch.  Quantitative finance concepts and uses.  Breaking down computer\nscience concepts(operating systems, technical frameworks and their uses). Frontend and Backend daily web applications.\nPortfolio for details.\n\u2022 Technical blogs\n\u2022 Non-technical blogs\nAchievements\n\u2022 Winner, Smart India Hackathon 2024 (Intra-college)\n\u2022 Winner, Smart India Hackathon 2023 (Intra-college)\n\u2022 Winner, Solving for India Hackathon 2023 (Inter-college)\n\u2022 Regional Round Winner, Dark Pattern Buster Hackathon 2024\n\u2022 Regional Round Winner, SAP Hackfest 2024\n\u2022 2nd runner-up, Leadership Unleashed, TAPMI 2025\n\u2022 Active contributor on LeetCode and CodeForces, solving complex algorithmic problems\n\n2\nMinor Projects\n\nMonitoring systems and scaling, pipeline and incident management applications, mathematical concepts(Trasformers,\nNIST papers etc.) implementation from scratch. Quantitative finance concepts and uses. Breaking down computer\nscience concepts(operating systems, technical frameworks and their uses). Frontend and Backend daily web applications.\nPortfolio for details.\n\u2022 Technical blogs\n\u2022 Non-technical blogs\nAchievements\n\n\u2022 Winner, Smart India Hackathon 2024 (Intra-college)\n\u2022 Winner, Smart India Hackathon 2023 (Intra-college)\n\u2022 Winner, Solving for India Hackathon 2023 (Inter-college)\n\u2022 Regional Round Winner, Dark Pattern Buster Hackathon 2024\n\u2022 Regional Round Winner, SAP Hackfest 2024\n\u2022 2nd runner-up, Leadership Unleashed, TAPMI 2025\n\u2022 Active contributor on LeetCode and CodeForces, solving complex algorithmic problems\n\n2",
    "file_path": "data/uploads/20250605_121624_DHANRAJ_RATERIA_BE_FINAL (2) - Dhanraj Rateria.pdf",
    "parsed_at": "2025-06-05T12:26:21.056110",
    "parser_type": "OCR+AI"
  },
  {
    "id": "20250619_151812",
    "filename": "20250619_151807_Vasudeva_s_Resume - H G VASUDEVA.pdf",
    "uploaded_at": "2025-06-01T06:00:37Z",
    "status": "parsed_and_stored",
    "uploaded_by": "pranamya-jain",
    "team": "Seeds! \ud83c\udf31",
    "name": "H G Vasudeva",
    "email": "1ms22ai016@msrit.edu",
    "phone": "+91 8296621576",
    "location": "Bengaluru, Karnataka, India",
    "skills": [
      "Python",
      "C/C++",
      "Java",
      "MySQL",
      "HTML/CSS",
      "JavaScript",
      "Machine Learning",
      "Natural Language Processing",
      "Data Analytics",
      "Image Processing",
      "RAG-LLM",
      "Robotic Process Automation",
      "PowerBI",
      "VS Code",
      "Jupyter Notebook",
      "Arduino IDE",
      "Selenium",
      "Roboflow",
      "Apache Mahout",
      "Apache Hadoop",
      "Apache Spark",
      "UI Path",
      "eBPF"
    ],
    "experience": [
      {
        "title": "Worklet Intern",
        "company": "Samsung PRISM \u2014 Samsung R&D Institute, Bengaluru",
        "duration": "Sept 2024 \u2013 Jun 2025",
        "description": "Developed tools using eBPF, C and Python to analyze Linux anonymous memory and swap operations\nPerformed page-level analysis for memory content duplication and swap-in/swap-out cycles\nGenerated timeline-based representations of memory usage from multiple snapshots\nCreated a workflow for efficient testing and removal of duplicates using a hybrid fuzzy-hierarchical model"
      }
    ],
    "education": [
      {
        "degree": "Bachelor of Technology",
        "institution": "Ramaiah Institute of Technology, Bengaluru",
        "year": "Dec 2022 \u2013 May 2026",
        "field": "Artificial Intelligence and Machine Learning"
      }
    ],
    "experience_years": 0,
    "summary": null,
    "certifications": [],
    "languages": [
      "Python",
      "C/C++",
      "Java",
      "MySQL",
      "HTML/CSS",
      "JavaScript"
    ],
    "projects": [
      {
        "name": "Enhanced Solution for Waste Management Along With a Novel Litter Surveillance System using OpenCV, YOLO and IoT Techniques",
        "description": null,
        "technologies": [
          "OpenCV",
          "YOLO",
          "IoT"
        ]
      },
      {
        "name": "Forecasting Future Water Requirements and Assessing Storage Capacities in Reservoirs",
        "description": null,
        "technologies": []
      },
      {
        "name": "Dark-pattern Identifier Using Machine Learning and CNNs",
        "description": null,
        "technologies": [
          "Machine Learning",
          "CNNs"
        ]
      }
    ],
    "raw_text": "Last updated in April 2025\n\n        H G Vasudeva\n\n     + Bengaluru, Karnataka, India  # 1ms22ai016@msrit.edu  \u0084 +91 8296621576  \u00f0 vasudeva-h-g\n\n                            \u00a7 Sevengods77\n\nEducation\n\n Ramaiah Institute of Technology, Bengaluru                               Dec 2022 \u2013 May 2026\n Bachelor of Technology in Artificial Intelligence and Machine Learning\n   \u25e6GPA: 9.46/10 (as of Apr 2025)\n    \u25e6Technical Clubs: Developers Student Club (Core), TensorAI (Core)\n    \u25e6Volunteering: NSS (Core Leader), U&I (Volunteer), RIT TechFest (Student Coordinator)\n\nExperience\n\n Memory Content and Swap Operation Analytics                                Sept 2024 \u2013 Jun 2025\n Worklet Intern, Samsung PRISM \u2014 Samsung R&D Institute, Bengaluru\n Mentor: Vaisakh P S\n vaisakh.ps@samsung.com\n   \u25e6Developed tools using eBPF, C and Python to analyze Linux anonymous memory and swap operations\n   \u25e6Performed page-level analysis for memory content duplication and swap-in/swap-out cycles\n   \u25e6Generated timeline-based representations of memory usage from multiple snapshots\n   \u25e6Created a workflow for efficient testing and removal of duplicates using a hybrid fuzzy-hierarchical model\n\nTechnical Skills\n\n Languages: Python, C/C++, Java, MySQL, HTML/CSS, JavaScript\n\n Techniques: Machine Learning, Natural Language Processing, Data Analytics, Image Processing, RAG-LLM,\n Robotic Process Automation\n\n Tools: PowerBI, VS Code, Jupyter Notebook, Arduino IDE, Selenium, Roboflow, Apache Mahout, Apache\n Hadoop, Apache Spark, UI Path\n\nAchievements\n\n   \u25e61st Runner-up, Unisys Innovation Program Year 15, 2024\n   \u25e61st Prize, Protatva Project Exhibition 2024 (RVIT, Bengaluru)\n   \u25e6Best IoT/AI Implementation, Ambition Hackathon (BIT, Bengaluru)\n    \u25e6Participant, E-Yantra Competition 2023 (IIT Bombay)\n    \u25e6Participant, Smart India Hackathon 2024\n\nProjects\n\n Enhanced Solution for Waste Management Along With a Novel Litter      Jan 2024 \u2013 May 2024\n Surveillance System using OpenCV, YOLO and IoT Techniques\n\n   \u25e6Reference: Github Repo 2   Patent Published: App No. 202441050632, Published on 05/07/2024\n\n Forecasting Future Water Requirements and Assessing Storage Capaci-      Jan 2024 \u2013 May 2024\n  ties in Reservoirs\n\n   \u25e6Reference: Github Repo 2   Patent Published: App No. 202441050632, Published on 05/07/2024\n\n Dark-pattern Identifier Using Machine Learning and CNNs                  Jan 2023 \u2013 Feb 2023\n\n   \u25e6Reference: GitHub Repo 2\n\nH G Vasudeva - Pag 1 of 1\nLast updated in April 2025\n\nH G Vasudeva\n\n+ Bengaluru, Karnataka, India\n# 1ms22ai016@msrit.edu\n\u0084 +91 8296621576\n\u00f0 vasudeva-h-g\n\n\u00a7 Sevengods77\n\nEducation\n\nRamaiah Institute of Technology, Bengaluru\nBachelor of Technology in Artificial Intelligence and Machine Learning\nDec 2022 \u2013 May 2026\n\n\u25e6GPA: 9.46/10 (as of Apr 2025)\n\u25e6Technical Clubs: Developers Student Club (Core), TensorAI (Core)\n\u25e6Volunteering: NSS (Core Leader), U&I (Volunteer), RIT TechFest (Student Coordinator)\n\nExperience\n\nMemory Content and Swap Operation Analytics\nWorklet Intern, Samsung PRISM \u2014 Samsung R&D Institute, Bengaluru\nMentor: Vaisakh P S\nvaisakh.ps@samsung.com\n\nSept 2024 \u2013 Jun 2025\n\n\u25e6Developed tools using eBPF, C and Python to analyze Linux anonymous memory and swap operations\n\u25e6Performed page-level analysis for memory content duplication and swap-in/swap-out cycles\n\u25e6Generated timeline-based representations of memory usage from multiple snapshots\n\u25e6Created a workflow for efficient testing and removal of duplicates using a hybrid fuzzy-hierarchical model\n\nTechnical Skills\n\nLanguages: Python, C/C++, Java, MySQL, HTML/CSS, JavaScript\n\nTechniques: Machine Learning, Natural Language Processing, Data Analytics, Image Processing, RAG-LLM,\nRobotic Process Automation\n\nTools: PowerBI, VS Code, Jupyter Notebook, Arduino IDE, Selenium, Roboflow, Apache Mahout, Apache\nHadoop, Apache Spark, UI Path\n\nAchievements\n\n\u25e61st Runner-up, Unisys Innovation Program Year 15, 2024\n\u25e61st Prize, Protatva Project Exhibition 2024 (RVIT, Bengaluru)\n\u25e6Best IoT/AI Implementation, Ambition Hackathon (BIT, Bengaluru)\n\u25e6Participant, E-Yantra Competition 2023 (IIT Bombay)\n\u25e6Participant, Smart India Hackathon 2024\n\nProjects\n\nEnhanced Solution for Waste Management Along With a Novel Litter\nSurveillance System using OpenCV, YOLO and IoT Techniques\nJan 2024 \u2013 May 2024\n\n\u25e6Reference: Github Repo 2\nPatent Published: App No. 202441050632, Published on 05/07/2024\n\nForecasting Future Water Requirements and Assessing Storage Capaci-\nties in Reservoirs\nJan 2024 \u2013 May 2024\n\n\u25e6Reference: Github Repo 2\nPatent Published: App No. 202441050632, Published on 05/07/2024\n\nDark-pattern Identifier Using Machine Learning and CNNs\nJan 2023 \u2013 Feb 2023\n\n\u25e6Reference: GitHub Repo 2\n\nH G Vasudeva - Pag 1 of 1",
    "file_path": "data/uploads/20250619_151807_Vasudeva_s_Resume - H G VASUDEVA.pdf",
    "parsed_at": "2025-06-19T15:18:12.400724",
    "parser_type": "OCR+AI"
  }
]